cnt,pdate,title,description,org_link,link
252,2024-02-15 08:49:00,"엔비디아, 알파벳도 제쳤다…美 시총 3위",CNBC는 <b>인공지능</b>(AI) 기술을 직접 개발하고 제품에 통합하는 대형 소프트웨어 회사나 클라우드 제공업체보다 AI 칩을 판매하는 엔비디아가 칩 판매량 증가에 힘입어 월가의 사랑을 더 많이 받는 기업이 됐다고... ,https://zdnet.co.kr/view/?no=20240215075847,https://n.news.naver.com/mnews/article/092/0002321326?sid=105
253,2024-02-15 08:48:00,진격의 엔비디아…주가 2.5% 올라 하루만에 美시총 4위→3위,아마존 이어 구글 알파벳도 제쳐…21일 실적 발표 앞두고 기대감 고조 임미나 특파원 = <b>인공지능</b>(AI) 반도체 대장주 엔비디아가 강력한 주가 상승세를 이어가며 미국 상장기업 시가총액 3위 자리에 올랐다. 하루만에... ,https://www.yna.co.kr/view/AKR20240215023200075?input=1195m,https://n.news.naver.com/mnews/article/001/0014505979?sid=104
254,2024-02-15 08:48:00,"목암연구소-이화여대, AI 기반 신약개발 연구 MOU 체결","목암생명과학연구소(소장 김선, 이하 목암연구소)가 이화여자대학교와 '<b>인공지능</b> 알고리즘을 이용한 신약개발 협력 연구'를 위한 업무협약을 체결했다. 협약식은 13일 오후 서울 서초동에 위치한 목암연구소에서 김선... ",https://www.medipana.com/article/view.php?news_idx=322781&sch_cate=D,https://www.medipana.com/article/view.php?news_idx=322781&sch_cate=D
255,2024-02-15 08:48:00,"뉴욕증시, 급락 하루 만에 반등…나스닥 1.3%↑마감","그는 여기에 예상보다 강한 실적과 <b>인공지능</b>(AI) 낙관론이 랠리의 주요 동인이었지만, 매그니피센트7 종목의 밸류에이션이 극단적 수준에 다다르면서 &quot;조정 위험이 상당히 높은 상황&quot;이라고 지적했다.... ",https://news.einfomax.co.kr/news/articleView.html?idxno=4298550,https://news.einfomax.co.kr/news/articleView.html?idxno=4298550
256,2024-02-15 08:48:00,"美 펜실베니아 대학, AI 전공 개설…아이비리그 최초로 AI 학위 부여",펜실베이니아 대학교가 아이비리그 대학 중 최초로 <b>인공지능</b>(AI) 전공을 개설한다. [사진: 셔터스톡] 펜실베이니아 대학교가 아이비리그 대학 중 최초로 <b>인공지능</b>(AI) 전공을 개설한다고 14일(현지시간) 경제매체... ,https://www.digitaltoday.co.kr/news/articleView.html?idxno=505940,https://www.digitaltoday.co.kr/news/articleView.html?idxno=505940
257,2024-02-15 08:47:00,"예스티, HBM 필수 장비 등 반도체 수주 호조에 '흑자전환'",예스티 관계자는 &quot;지난해 하반기 HBM 장비 첫 수주 이후 반도체 장비 분야 역대 최대 수주액을 달성해 지난해 턴어라운드에 성공했다&quot;며 &quot;<b>인공지능</b>(AI) 기업들의 HBM 수요 확대에 따라 올해에도 HBM용 장비 수주는 지속될... ,http://www.newsis.com/view/?id=NISX20240215_0002627152&cID=10403&pID=15000,https://n.news.naver.com/mnews/article/003/0012373650?sid=101
258,2024-02-15 08:46:00,"텐마인즈, 2024 헬스케어 키워드 ‘M.O.V.E.’ 제시","특히 AI(<b>인공지능</b>)을 통해 개인 맞춤형 움직임을 유도하여 건강 관리에 앞장선다. 실제로 인간의 신체는 계속해서 같은 자세를 취하고 있는 것이 아닌, 적절한 움직임을 가해 건강한 상태를 유지할 수 있다. Observe... ",http://www.beyondpost.co.kr/view.php?ud=20240215084220112846a9e4dd7f_30,http://www.beyondpost.co.kr/view.php?ud=20240215084220112846a9e4dd7f_30
259,2024-02-15 08:46:00,[맨발人] 김용호 서울시의원 “올해 서울 시내 3곳에 맨발걷기길 조성해 시민...,"또 태양열 AI 가로등을 도입해 전기료를 절감하고 범죄를 예방하는 사업, 하수를 에너지화하는 방안, <b>인공지능</b>(AI) 기반 119종합상황관리체계 구축, 119응급환자 이송 최적화 통합플랫폼 구축, 실화재 훈련장 및 소방차... ",https://www.sportsseoul.com/news/read/1399193?ref=naver,https://n.news.naver.com/mnews/article/468/0001030561?sid=102
260,2024-02-15 08:46:00,"목암생명과학硏-이화여대, AI 기반 신약개발 MOU",목암생명과학연구소(소장 김선)는 이화여자대학교와 '<b>인공지능</b> 알고리즘을 이용한 신약개발 협력 연구'를 위한 업무협약을 체결했다고 14일 밝혔다. 목암생명과학연구소 김선 소장(왼쪽)과 이화여대 약학대학 최선 교수.... ,http://www.bosa.co.kr/news/articleView.html?idxno=2216651,http://www.bosa.co.kr/news/articleView.html?idxno=2216651
261,2024-02-15 08:45:00,애플 한물갔나? 버핏 애플 주식 1000만주 매도,"최근 월가에서 <b>인공지능</b>(AI) 열풍이 불며 애플이 마이크로소프트(MS)에 시총 1위를 내주는 등 고전하고 있는 가운데, '투자의 귀재' 워런 버핏이 애플의 주식을 대거 매도한 것으로 나타났다. 미국 월스트리트저널(WSJ)... ",https://www.news1.kr/articles/5321093,https://n.news.naver.com/mnews/article/421/0007351972?sid=104
262,2024-02-15 08:44:00,"목암연구소-이화여대, AI 기반 신약개발 연구 협력","목암생명과학연구소(소장 김선, 이하 목암연구소)는 이화여자대학교와 '<b>인공지능</b> 알고리즘을 이용한 신약개발 협력 연구'를 위한 업무협약을 체결했다고 14일 밝혔다. 협약식은 13일 오후 서울 서초동에 위치한... ",http://www.medisobizanews.com/news/articleView.html?idxno=113995,http://www.medisobizanews.com/news/articleView.html?idxno=113995
263,2024-02-15 08:44:00,목암생명과학연구소·이화여대 '맞손'... 'AI 기반 신약개발 연구',사진=목암생명과학연구소  목암생명과학연구소(이하 목암연구소)는 이화여자대학교와 '<b>인공지능</b> 알고리즘을 이용한 신약개발 협력 연구'를 위한 업무협약을 체결했다고 15일 밝혔다. 협약식은 지난 13일 서울 서초동에... ,https://www.pointdaily.co.kr/news/articleView.html?idxno=190520,https://www.pointdaily.co.kr/news/articleView.html?idxno=190520
264,2024-02-15 08:44:00,"목암생명과학연-이화여대,AI 기반 신약개발 연구 MOU 체결",목암생명과학연구소(소장 김선)는 13일  목암연구소에서 이화여자대학교와 ‘<b>인공지능</b> 알고리즘을 이용한 신약개발 협력 연구’ 업무협약을 체결했다.이번 협약을 통해 양측은 각자 연구역량을 바탕으로 <b>인공지능</b> 기반... ,http://www.yakup.com/news/index.html?mode=view&cat=12&nid=290481,http://www.yakup.com/news/index.html?mode=view&cat=12&nid=290481
265,2024-02-15 08:43:00,"SK C&amp;C, 메리츠증권에 'AI 주식 주문 최적화' 서비스 제공",SK C&amp;C는 메리츠증권에 고객 맞춤형 <b>인공지능</b>(AI) 주식 주문 최적화 서비스인 ‘마켓캐스터 AI 트레이딩’을 제공한다고 15일 밝혔다. 마켓캐스터 AI트레이딩은 금융에 특화된 AI 모델링을 통해 최적 주식 매수·매도... ,https://biz.chosun.com/it-science/ict/2024/02/15/FYOXOYKARFEMZBTPC7XE22P6TE/?utm_source=naver&utm_medium=original&utm_campaign=biz,https://n.news.naver.com/mnews/article/366/0000970457?sid=105
266,2024-02-15 08:43:00,"카카오, 연매출 8조1000억 역대 최대...각종 리스크에 영업이익은 줄어",카카오는 앞으로 카카오톡에 <b>인공지능</b>(AI) 기능을 결합해 광고 및 상거래 관련 사업을 지속적으로 성장시키겠다는 계획이다. 카카오모빌리티와 카카오페이 등으로 대표되는 플랫폼 기타 부문 매출 역시 4521억원으로... ,https://www.chosun.com/economy/tech_it/2024/02/15/6NFCI4T2LVE6PH33GWGOTJU7QU/?utm_source=naver&utm_medium=referral&utm_campaign=naver-news,https://n.news.naver.com/mnews/article/023/0003816783?sid=105
267,2024-02-15 08:42:00,"[상보]미국 뉴욕증시, 6월엔 금리인하? 나스닥-반도체 등 기술주 급등...선물...","그는 여기에 예상보다 강한 실적과 <b>인공지능</b>(AI) 낙관론이 랠리의 주요 동인이었지만, 매그니피센트7 종목의 밸류에이션이 극단적 수준에 다다르면서 &quot;조정 위험이 상당히 높은 상황&quot;이라고 지적했다.... ",https://www.socialvalue.kr/news/view/1065562313932582,https://www.socialvalue.kr/news/view/1065562313932582
268,2024-02-15 08:42:00,"경북도-포항테크노파크, 지역 AI산업 기반 확대와 벤처육성 앞장",'중소벤처기업 AI 기술 융합 Scale-up 사업'은 경상북도가 지난 2022년부터 지역 <b>인공지능</b> 기반 중소벤처 기업의 R&amp;D 역량을 강화하기 위해 시작했다. 2026년까지 5년간 기업 발굴과 기술개발 지원으로 도내 <b>인공지능</b>... ,http://www.newsprime.co.kr/news/article.html?no=628231,http://www.newsprime.co.kr/news/article.html?no=628231
269,2024-02-15 08:42:00,"'현대해상 오너2세' 정경선, 광폭행보… 이번엔 SKT 뚫었다","이달 5일 인터넷 은행 설립 인가를 위해 세무 스타트업 자비스앤빌런즈, 의료 <b>인공지능</b>(AI) 기업 루닛 등 컨소시엄에 참여한지 9일 만에 타 업종 기업과 파트너 관계를 맺었다. 이번 현대해상과 SK텔레콤의 협력은 보험... ",https://www.moneys.co.kr/article/2024021508375962812,https://n.news.naver.com/mnews/article/417/0000981756?sid=101
270,2024-02-15 08:41:00,"[상보] 카카오, 지난해 연간 매출 첫 8조원 돌파","향후 카카오톡과 <b>인공지능</b>(AI)의 결합을 통해 긍정적인 이용자 경험을 확대하고, 이를 바탕으로 광고 및 커머스 등 카카오의 핵심 비즈니스의 성장이 지속적으로 이어질 수 있도록 선순환 구조를 굳건히 할... ",http://www.fnnews.com/news/202402150817032144,https://n.news.naver.com/mnews/article/014/0005142427?sid=105
271,2024-02-15 08:41:00,"SK텔레콤-현대해상, AI 기반 보험 서비스 구축 추진",SK텔레콤과 현대해상은 <b>인공지능</b>(AI) 기술을 활용한 보험 사업 혁신의 공동 추진을 위해 전략적 제휴(MOU)를 체결했다고 15일 밝혔다. 양사는 보험의 AI 전환 차원에서 AI 기반 보험 서비스 구축을 검토하기로 했다.... ,https://www.yna.co.kr/view/AKR20240215027100017?input=1195m,https://n.news.naver.com/mnews/article/001/0014505966?sid=105
272,2024-02-15 08:40:00,[증권사 CFO가 말한다] 미래에셋증권 이강혁,올해 <b>인공지능</b>(AI) 기술을 활용해 개인 맞춤형 포트폴리오를 제공하는 등 고객 서비스를 고도화하고 있다. -- 최근 정부의 '기업 밸류업 프로그램' 발표로 상장사의 주주환원 정책에 대한 관심이 커지고 있다.... ,https://news.einfomax.co.kr/news/articleView.html?idxno=4298549,https://news.einfomax.co.kr/news/articleView.html?idxno=4298549
273,2024-02-15 08:40:00,"[3D익스피리언스 월드 2024] &quot;설계 넘어 한국 사업 확대, 대규모 고객에도 집...",AI(<b>인공지능</b>)를 구동하기 위한 반도체 수요가 높아지는 상황에서 시뮬레이션 기술을 활용해 속도와 정밀도를 높일 수 있을 것이라는 이야기다. 바씨 부사장은 AI와 클라우드 기반 솔루션의 중요성도 역설했다.... ,https://www.dt.co.kr/contents.html?article_no=2024021502109932820001&ref=naver,https://n.news.naver.com/mnews/article/029/0002855307?sid=101
274,2024-02-15 08:40:00,"카카오, 작년 영업익 5019억···전년比 10.9%↓","카카오 관계자는 &quot;카카오톡의 서비스 개편과 이용자 편의 개선 등 종합 커뮤니케이션 서비스로 진화하기 위한 프로젝트를 지속적으로 추진하고 있다&quot;며 &quot;향후, 카카오톡과 <b>인공지능</b>(AI)의 결합을 통해 긍정적인... ",https://www.sisajournal-e.com/news/articleView.html?idxno=400383,https://www.sisajournal-e.com/news/articleView.html?idxno=400383
275,2024-02-15 08:40:00,"엔비디아, 시가총액 3위 질주..아마존 이어 구글도 제쳐",젠슨 황(오른쪽) 엔비디아 최고경영자(CEO) [출처: 엔비디아 홈페이지] <b>인공지능</b>(AI) 바람을 타고 엔비디아의 시가총액이 14일(현지시간) 구글의 모기업 알파벳을 추월했다. 전일 아마존을 제친 데 이어 알파벳까지... ,https://www.smarttoday.co.kr/news/articleView.html?idxno=43714,https://www.smarttoday.co.kr/news/articleView.html?idxno=43714
276,2024-02-15 08:40:00,"무하유, '국회도서관 융복합서비스 데이터셋 구축 사업' 성료",컨슈머타임스=김윤호 기자 | 자연어를 이해하는 실용 <b>인공지능</b>(AI) 기업 무하유(대표 신동호)가 '국회도서관 융복합서비스 데이터셋 구축 사업'을 성료했다고 15일 밝혔다. 무하유는 이번 사업을 통해 국회도서관에서... ,https://www.cstimes.com/news/articleView.html?idxno=579450,https://www.cstimes.com/news/articleView.html?idxno=579450
277,2024-02-15 08:39:00,&quot;햄 아직 창창하데이&quot;…Z세대 구애 나선 美 석유 재벌 [김리안의 에네르기파W...,"테렌스 팰리쉬 석유기술자협회 회장은 &quot;석유가스가 과연 컴퓨팅, <b>인공지능</b>(AI) 같은 하이테크만큼 '섹시한' 산업으로 통할까요?&quot;라고 반문한 뒤 &quot;우리가 얼마나 멋진 일을 하고 있는지 대중에게 알리는 게 중요하다&quot;고... ",https://www.hankyung.com/article/202402130353i,https://n.news.naver.com/mnews/article/015/0004948552?sid=104
278,2024-02-15 08:38:00,"더존비즈온, 실적반등 성공…올해가 더 기대","더존비즈온은 올해 <b>인공지능</b>(AI) 사업을 통해 새로운 먹거리 발굴에 나선다. AI 관련 사업은 개발 플랫폼(ZEN AI DEWS), 비즈니스 플랫폼, 데이터 분석 도구 등 3가지가 있다. 더존비즈온은 개발 원가를 AI로 줄이는 개발... ",http://www.datanews.co.kr/news/article.html?no=131390,http://www.datanews.co.kr/news/article.html?no=131390
279,2024-02-15 08:38:00,"이마트, 영업손실 469억원…&quot;신세계 건설 부진했지만 G마켓은 흑자전환 성공&quot;","상품을 가격 비교해 최저가 기준으로, 개별 고객이 보유한 최대 쿠폰을 선 적용해 추천해주는 '초개인화' 서비스를 더욱 고도화한다. 또한 풀필먼트 운영 개선과 AI(<b>인공지능</b>) 광고 서비스 강화로 수익 확대에 나선다.",http://www.betanews.net:8080/article/1459445.html,http://www.betanews.net:8080/article/1459445.html
280,2024-02-15 08:38:00,[발언대]<b>인공지능</b>(AI) 시대에 즈음하여,"AI는 인간의 <b>지능</b>이 가지는 학습, 추리, 전용 논증 따위의 기능을 갖춘 컴퓨터 시스템이라고 한다. 이러한 AI는 우리를 놀라게 한다. 챗봇이 우리의 언어로 자연스럽게 대화를 나누고 있다. 시를 짓기도 하고 그림을... ",https://www.idomin.com/news/articleView.html?idxno=903920,https://www.idomin.com/news/articleView.html?idxno=903920
281,2024-02-15 08:38:00,"목암생명과학연구소-이화여자대학교, AI 기반 신약개발 연구 위한 MOU 체결",목암생명과학연구소(이하 목암연구소)는 이화여자대학교와 '<b>인공지능</b> 알고리즘을 이용한 신약개발 협력 연구'를 위한 업무협약을 체결했다고 15일 밝혔다. 협약식은 13일 오후 서울 서초동에 위치한 목암연구소에서 김선... ,http://www.kmedinfo.co.kr/news/articleView.html?idxno=83093,http://www.kmedinfo.co.kr/news/articleView.html?idxno=83093
282,2024-02-15 08:38:00,"카카오, SM 인수로 '8조클럽' 진입...수익성 개선은 숙제(종합)",카카오는 “카카오톡의 서비스 개편과 이용자 편의 개선 등 종합 커뮤니케이션 서비스로 진화하기 위한 프로젝트를 지속적으로 추진하고 있다”며 “향후 카카오톡과 AI(<b>인공지능</b>)의 결합을 통해 긍정적인 이용자... ,https://www.dailian.co.kr/news/view/1328445/?sc=Naver,https://n.news.naver.com/mnews/article/119/0002799683?sid=105
283,2024-02-15 08:38:00,IBM “기업 내 AI 도입 답보… 40%는 여전히 검토 단계”,"2019년부터 <b>인공지능</b>(AI) 도입을 검토 및 활용 중인 기업의 비율은 꾸준히 약 81%에 달했지만, 지난해 조사 결과 40%는 여전히 AI를 배포하지 못한 채 검토하는 단계에 머무르는 것으로 조사됐다. 이 설문조사는 IBM이... ",https://biz.chosun.com/it-science/ict/2024/02/15/RWTBNXDHSNHXFDPYKFWHEHJS7Y/?utm_source=naver&utm_medium=original&utm_campaign=biz,https://n.news.naver.com/mnews/article/366/0000970455?sid=105
284,2024-02-15 08:38:00,챗GPT發 AI 열풍에도…기업 AI 도입은 아직 '난관',[사진=IBM] 챗GPT의 급부상으로 지난해 <b>인공지능</b>(AI) 붐이 일었지만 아직 상당수 기업들이 AI를 비즈니스에 실질적으로 도입하는 데 어려움을 겪는 것으로 나타났다. 15일 IBM이 발표한 'IBM 글로벌 AI 도입 지수 2023... ,https://www.ajunews.com/view/20240215083509410,https://www.ajunews.com/view/20240215083509410
285,2024-02-15 08:37:00,“주식 언제 살까? AI가 알려준다” SK C＆C ‘AI 주식 거래 트레이딩 서비스...,<b>인공지능</b>(AI)이 최적의 주식 주문 시점을 찾아주는 서비스가 확대된다. SK C&amp;C는 메리츠증권에 고객 맞춤형 AI 주식 주문 최적화 서비스 ‘마켓캐스터 AI 트레이딩’을 제공한다고 15일 밝혔다. 마켓캐스터... ,http://news.heraldcorp.com/view.php?ud=20240215050058,https://n.news.naver.com/mnews/article/016/0002266763?sid=105
286,2024-02-15 08:36:00,"&quot;디지털 혁신 이끌 주역 찾습니다&quot;…'김영섭호' KT, 대규모 공채","모집 분야는 △초거대 <b>인공지능</b>(AI) 기술개발 등 연구개발(R&amp;D)분야 △아키텍트, 소프트웨어(SW)개발, IT 프로젝트 전략·설계 등 IT분야 △클라우드 네이티브 및 멀티·하이브리드 클라우드 전환을 위한 기술컨설팅분야... ",https://www.news1.kr/articles/5321060,https://n.news.naver.com/mnews/article/421/0007351955?sid=105
287,2024-02-15 08:36:00,"목암생명과학연구소-이화여자대학교, AI 기반 신약개발 연구를 위한 MOU","목암생명과학연구소(소장 김선, 이하 목암연구소)는 이화여자대학교와 '<b>인공지능</b> 알고리즘을 이용한 신약개발 협력 연구'를 위한 업무협약을 체결했다고 14일 밝혔다. 협약식은 13일 오후 서울 서초동에 위치한... ",https://www.pharmnews.com/news/articleView.html?idxno=239603,https://www.pharmnews.com/news/articleView.html?idxno=239603
288,2024-02-15 08:36:00,[굿모닝 증시]굴스비 &quot;인플레 완화중&quot;…&quot;코스피 상승 출발 예상 &quot;,"국내 증시에서도 <b>인공지능</b>(AI) 관련 종목에 투자심리가 확대될 것으로 예상된다. 한지영 키움증권 연구원은 &quot;어제 강세를 보인 테마는 AI 수혜주, 방산 정책주, 중국 소비 등 저 주가순자산비율(PBR) 장세에서 소외된... ",https://view.asiae.co.kr/article/2024021508301226653,https://n.news.naver.com/mnews/article/277/0005379983?sid=101
289,2024-02-15 08:35:00,"메리츠증권 &quot;NHN, 부진한 영업적자 기록…목표가↓&quot;",그러면서 &quot;서비스형 인프라(IaaS)에서 생성 <b>인공지능</b>(AI)을 비롯한 서비스형 소프트웨어(SaaS)로 중심이 바뀌는데 따른 장기 경쟁력 약화로 해석된다&quot;며 &quot;올해 클라우드 포함 기술 매출은 3696억원으로 지난해와 유사할... ,http://www.newsis.com/view/?id=NISX20240215_0002627116&cID=10403&pID=15000,https://n.news.naver.com/mnews/article/003/0012373628?sid=101
290,2024-02-15 08:34:00,&quot;백신 피하는 코드 작성에 활용&quot;…북·중·러 해커도 '챗GPT' 쓴다,북한·중국·러시아 정부를 위해 일하는 해커들이 오픈AI의 생성형 <b>인공지능</b>(AI) '챗GPT'를 활용한 것으로 확인됐다. 해커들이 AI를 활용해 새로운 사이버공격 방식을 만든 정황은 포착되지 않았다. 하지만 오픈AI와... ,http://news.mt.co.kr/mtview.php?no=2024021507513517448,https://n.news.naver.com/mnews/article/008/0004998885?sid=104
291,2024-02-15 08:34:00,"KT그룹, AI·IT·클라우드 인재 모집…사원부터 임원급까지 전 직급 채용",이어 2023년부터는 KAIST와 포항공대에도 'KT <b>인공지능</b> 석사과정'을 개설해 운영하고 있다. 해당 과정은 전일제로 2년간 운영되는 채용연계형 학과로 각 대학의 <b>인공지능</b>대학원 교수진들이 직접 참여한다. 또 2021년... ,https://www.smarttoday.co.kr/news/articleView.html?idxno=43713,https://www.smarttoday.co.kr/news/articleView.html?idxno=43713
292,2024-02-15 08:34:00,[Who Is ?] 송재호 경동도시가스 대표이사 회장,"이어 카카오엔터프라이즈가 보유한 클라우드, <b>인공지능</b>(AI) 기술을 바탕으로 가스얼라이언스 회원사의 서비스와 운영 전반을 디지털로 전환하는 방향으로 협력의 범위를 확대해 나가기로 했다. 이 과정에서... ",https://www.businesspost.co.kr/BP?command=article_view&num=342486,https://www.businesspost.co.kr/BP?command=article_view&num=342486
293,2024-02-15 08:32:00,"부산대학교 의학과 장철훈 교수, '원헬스와 신종감염병' K-MOOC 교육부장관 표...","에너지신산업, <b>인공지능</b>, 지속가능발전(SDGs), 로컬인문학 등 4개 분야를 특화분야로 지정해 강좌를 개발했다. 부산대는 국립대 중 유일하게 K-MOOC 전문부서에서 강좌의 전 프로세스를 자체개발·운영하고 있으며... ",https://www.lecturernews.com/news/articleView.html?idxno=146591,https://www.lecturernews.com/news/articleView.html?idxno=146591
294,2024-02-15 08:31:00,"카카오, 작년 연매출 8조 돌파…&quot;카톡 개편이 성장 견인&quot;","카카오 측은 &quot;카카오톡과 AI(<b>인공지능</b>)의 결합을 통해 긍정적인 이용자 경험을 확대하고, 이를 바탕으로 광고 및 커머스 등 카카오의 핵심 비즈니스의 성장이 지속적으로 이어질 수 있도록 선순환 구조를 굳건히 할... ",http://www.newsis.com/view/?id=NISX20240215_0002627093&cID=13006&pID=13100,https://n.news.naver.com/mnews/article/003/0012373624?sid=105
295,2024-02-15 08:31:00,"카카오, 지난해 매출 8조원 첫 돌파…영업이익은 '숨 고르기'","향후 카카오톡과 <b>인공지능</b>(AI) 결합으로 긍정적인 이용자 경험을 확대하고, 이를 바탕으로 광고와 커머스 등 카카오 핵심 비즈니스 성장이 지속적으로 이어지도록 선순환 구조를 마련한다.",https://www.etnews.com/20240215000004,https://n.news.naver.com/mnews/article/030/0003181018?sid=101
296,2024-02-15 08:30:00,"SK C&amp;C, 메리츠증권에 'AI 주식 주문 최적화' 서비스 제공",SK주식회사 C&amp;C는 메리츠증권에 고객 맞춤형 <b>인공지능</b>(AI) 주식 주문 최적화 서비스인 '마켓캐스터 AI 트레이딩'을 제공한다고 15일 밝혔다. 마켓캐스터AI트레이딩은 금융에 특화한 AI 모델링을 통해 최적 주식 매수... ,https://www.yna.co.kr/view/AKR20240214147300017?input=1195m,https://n.news.naver.com/mnews/article/001/0014505946?sid=101
297,2024-02-15 08:29:00,"'톡비즈' 날았다…카카오, 연간 매출 8조 첫 돌파",카카오 관계자는 &quot;향후 카카오톡과 <b>인공지능</b>(AI)의 결합으로 긍정적인 이용자 경험을 확대할 것&quot;이라면서 &quot;광고·커머스 등 카카오의 핵심 비즈니스의 성장이 지속적으로 이어질 수 있도록 하겠다&quot;고 설명했다.... ,https://www.news1.kr/articles/5321055,https://n.news.naver.com/mnews/article/421/0007351938?sid=101
298,2024-02-15 08:28:00,"카카오, 작년 4분기 영업익 1892억원...전년比 109% 늘어",카카오 관계자는 “카카오는 카카오톡의 서비스 개편과 이용자 편의 개선 등 종합 커뮤니케이션 서비스로 진화하기 위한 프로젝트를 지속적으로 추진하고 있다”면서 “향후 카카오톡과 <b>인공지능</b>(AI)의 결합을... ,https://www.mk.co.kr/article/10942986,https://n.news.naver.com/mnews/article/009/0005258747?sid=105
299,2024-02-15 08:28:00,"“주식 일자무식이 친구 따라 사놨던 엔비디아, 309%나 올라 있네요” [투자3...",올해 들어 더 강력해진 AI(<b>인공지능</b>) 열풍으로 AI 반도체 시장의 절대 강자인 엔비디아의 주가가 파죽지세다. 14일(현지시간) 뉴욕증시에서도 엔비디아 주가는 전일대비 2.46% 오른 739달러를 기록했다. 227달러... ,http://news.heraldcorp.com/view.php?ud=20240215050049,https://n.news.naver.com/mnews/article/016/0002266754?sid=104
300,2024-02-15 08:27:00,카카오 지난해 매출 14% 증가…첫 8조 돌파,카카오는 “카카오톡 서비스 개편과 이용자 편의 개선 등 종합 커뮤니케이션 서비스로 진화하기 위한 프로젝트를 지속적으로 추진하고 있다”며 “카카오톡과 <b>인공지능</b>(AI)의 결합을 통해 긍정적인 이용자 경험을... ,https://www.hani.co.kr/arti/economy/it/1128419.html,https://n.news.naver.com/mnews/article/028/0002676945?sid=105
