cnt,pdate,title,description,org_link,link
1,2024-02-15 09:54:00,"[의정언박싱] &quot;생성형 AI, 위협 보단 또다른 새로운 기회 제공&quot;","그래서 이 <b>인공지능</b>의 이 기술의 수준이 매우 높아졌고. 그다음에 이것 또한 세상을 바꿀 수 있는 기술이라고 생각하게 되면서, 스터디를 좀 했고요. 공부를 좀 했고, 그 챗GPT에 관련된 활용 방법을 공부하면서, 아! 이게... ",https://news.ifm.kr/news/articleView.html?idxno=380517,https://news.ifm.kr/news/articleView.html?idxno=380517
2,2024-02-15 09:54:00,"KT그룹, 전방위 디지털 혁신분야 전문 인재 채용","모집 분야는 △초거대 AI(<b>인공지능</b>) 기술개발 등 R&amp;D(연구개발)분야 △아키텍트, SW개발, IT 프로젝트 전략·설계 등 IT분야 △클라우드 네이티브(Cloud Native) 및 멀티·하이브리드 클라우드 전환을 위한 기술컨설팅분야... ",https://www.news2day.co.kr/article/20240215500042,https://www.news2day.co.kr/article/20240215500042
3,2024-02-15 09:54:00,"KT그룹, 전문 인재 확보로 디지털 패러다임 전환 본격 박차","모집 분야는 초거대 <b>인공지능</b>(AI) 기술개발 등 연구개발(R&amp;D)분야, 아키텍트, 소프트웨어(SW)개발, IT 프로젝트 전략·설계 등 IT분야, 클라우드 네이티브(Cloud Native) 및 멀티·하이브리드 Cloud 전환을 위한 기술컨설팅분야... ",http://www.greenpostkorea.co.kr/news/articleView.html?idxno=215685,http://www.greenpostkorea.co.kr/news/articleView.html?idxno=215685
4,2024-02-15 09:53:00,"KT, IT·컨설팅·콘텐츠 등 전 직급 공개 채용 진행","모집 분야는 초거대 <b>인공지능</b>(AI) 기술개발 등 연구개발(R&amp;D) 분야, 아키텍트·소프트웨어(SW)개발·정보통신(IT) 프로젝트 전략 및 설계 등 IT분야, 신사업 기획·개발 및 B2B·B2G사업 제안·컨설팅분야, 디지털 미디어... ",https://biz.chosun.com/it-science/ict/2024/02/15/VHJWX2TS4JEG5JGVDNTMSZY3G4/?utm_source=naver&utm_medium=original&utm_campaign=biz,https://n.news.naver.com/mnews/article/366/0000970499?sid=105
5,2024-02-15 09:53:00,[컨콜]카카오톡에 생성형 AI 결합 추진…경량 언어모델 기반,카카오가 카카오톡과 생성형 AI(<b>인공지능</b>) 결합을 추진한다. 홍은택 카카오 대표는 15일 2023년 4분기 실적발표 컨퍼런스 콜에서 &quot;최근 전 국민이 생활 속에서 AI를 경험할 수 있도록 카카오톡과 AI의 결합을 실험 중... ,http://news.mt.co.kr/mtview.php?no=2024021509505999386,https://n.news.naver.com/mnews/article/008/0004998952?sid=105
6,2024-02-15 09:53:00,"우리은행, 메가존클라우드와 ‘BaaS’ 사업확대 업무협약","▷금융 서비스 ▷클라우드 ▷<b>인공지능</b>(AI) 등 양사가 보유한 디지털 기술과 서비스를 활용해, 금융과 비금융의 경계를 허무는 디지털 기반 신사업을 함께 개척한다. 또 양사는 BaaS 생태계에 진입한 스타트업과... ",http://news.heraldcorp.com/view.php?ud=20240215050150,https://n.news.naver.com/mnews/article/016/0002266848?sid=101
7,2024-02-15 09:53:00,"[STOCK] 카카오, '어닝 서프라이즈' 7% 강세… 카카오페이 주가도 쭉",이어 &quot;카카오톡과 AI(<b>인공지능</b>)의 결합을 통해 긍정적인 이용자 경험을 확대할 것&quot;이라며 &quot;이를 바탕으로 광고 및 커머스 등 카카오의 핵심 비즈니스의 성장이 지속적으로 이어질 수 있도록 선순환 구조를 굳건히... ,https://www.moneys.co.kr/article/2024021509354785430,https://n.news.naver.com/mnews/article/417/0000981776?sid=101
8,2024-02-15 09:53:00,"에스피소프트, 코스닥 상장…&quot;생성형 AI 기반 사업 확대&quot;",에스피소프트는 이번 상장자금으로 MS의 생성형 <b>인공지능</b>(AI) 기반 소프트웨어 프로그램 ‘코파일럿’의 라이선스 사업 확장에 나설 계획이다. 코파일럿은 생성형 AI인 챗GPT가 적용된 MS 소프트웨어다.... ,http://www.edaily.co.kr/news/newspath.asp?newsid=02069686638790848,https://n.news.naver.com/mnews/article/018/0005673841?sid=101
9,2024-02-15 09:52:00,"문체부, 2026년까지 AI 외신 분석 플랫폼 구축…40억 투입",문화체육관광부가 <b>인공지능</b>을 기반으로 한 외신 빅데이터 분석 플랫폼을 구축한다. 문체부 내 <b>인공지능</b>을 활용한 최초의 의사결정 지원 시스템이자 <b>인공지능</b>을 활용한 업무 디지털 전환 최초 사례다. 문체부는... ,http://www.newsis.com/view/?id=NISX20240215_0002627257&cID=10701&pID=10700,https://n.news.naver.com/mnews/article/003/0012373828?sid=103
10,2024-02-15 09:52:00,"아모레퍼시픽 '톤워크', '비건 200+ 파운데이션' 출시…205가지 색상 제공","톤워크 맞춤 파운데이션은 <b>인공지능</b>(AI) 기반의 컬러 진단과 조색 알고리즘에 기반해 정밀하게 얼굴 색상을 측정하고, 그 결과를 바탕으로 로봇이 주문 즉시 제품을 조제해 주는 서비스다. 이번에 출시하는 '톤워크... ",https://www.youthdaily.co.kr/news/article.html?no=145611,https://www.youthdaily.co.kr/news/article.html?no=145611
11,2024-02-15 09:52:00,"한투운용 ACE 글로벌메타버스테크액티브, 메타버스 수익률 1위","'AI5'는 매그니피센트7(M7) 다음으로 주목받는 <b>인공지능</b>(AI) 관련 5개의 종목으로, M7 중 AI 산업과 연관된 엔비디아와 마이크로소프트 외에 △TSMC △브로드컴 △AMD를 포함해 일컫는다. ACE... ",http://www.thebigdata.co.kr/view.php?ud=2024021509134727162abca1943_23,http://www.thebigdata.co.kr/view.php?ud=2024021509134727162abca1943_23
12,2024-02-15 09:52:00,"라온피플 ‘AI바우처 지원사업' 공급기업에 선정, 소상공인에 최대 2억 지원",라온피플이 소상공인에게 <b>인공지능</b>(AI) 기술 및 솔루션을 지원한다. 라온피플은 2010년 설립된 <b>인공지능</b> 솔루션 기업으로 △AI머신비전 솔루션 △AI스마트비전 솔루션 △카메라 모듈검사 솔루션 등 사업을 하고... ,https://www.businesspost.co.kr/BP?command=article_view&num=342511,https://www.businesspost.co.kr/BP?command=article_view&num=342511
13,2024-02-15 09:51:00,"삼성전자, 대규모 경력 채용…이재용 강조한 '기술인재' 영입","모집 공고별로는 삼성리서치가 AI(<b>인공지능</b>) 관련 인재를 뽑는다. 앞서 삼성전자는 AI 관련 경력인재를 채용했다. 비스포크 가전에 생성형 AI 적용을 위해 DA사업부에서 '<b>지능</b>형 S/W 경력사원 채용'을 실시했고, 삼성이... ",https://www.nocutnews.co.kr/news/6095680,https://n.news.naver.com/mnews/article/079/0003863733?sid=101
14,2024-02-15 09:50:00,"2018년 수준으로 하락한 독일 경제, 위기 극복할까","소프트웨어(SW), <b>인공지능</b>, 바이오 등의 첨단 기술 분야에서도 미국이나 중국에 비해 열세다. 특히 인구 감소와 고령화로 인한 노동력 부족 및 생산성 저하가 발목을 잡는다. 이는 제조업이 경제의 약 27%를 차지하는... ",http://www.g-enews.com/ko-kr/news/article/news_all/2024021408262821737926aa152_1/article.html,http://www.g-enews.com/ko-kr/news/article/news_all/2024021408262821737926aa152_1/article.html
15,2024-02-15 09:49:00,홍은택 카카오 &quot;자체 LLM '코GPT 2.0' 고도화 작업 중&quot;,카카오가 미래 성장 동력으로 주목받고 있는 자체개발 <b>인공지능</b>(AI) 대규모언어모델(LLM) ‘코GPT 2.0’가 현재 내부에서 테스트를 진행 중이라고 밝혔다. 홍은택 카카오 대표는 15일 컨퍼런스 콜에서 “카카오브레인 코GPT... ,https://zdnet.co.kr/view/?no=20240215092422,https://n.news.naver.com/mnews/article/092/0002321363?sid=105
16,2024-02-15 09:49:00,"SKT, 스마트폰 소비전력 절감 기술 개발…&quot;MWC에서 공개할 것&quot;","글로벌 모바일 AP 제조사 '미디어텍', <b>인공지능</b>(AI) 경량화 전문 스타트업 '노타'와 협력한 결과물이다. 이 기술은 단말이 이동통신 기지국과 데이터를 주고받을 때 송·수신 완료 이후에도 일정 시간 기지국과의 연결을... ",https://view.asiae.co.kr/article/2024021509495457880,https://n.news.naver.com/mnews/article/277/0005380062?sid=105
17,2024-02-15 09:48:00,"라이프시맨틱스, 피부암 진단보조 AI 확증임상 성공","라이프시맨틱스의 피부암 영상검출·진단보조 소프트웨어는 피부암 여부를 감별하는 의료 <b>인공지능</b>(AI) 솔루션이다. 라이프시맨틱스 관계자는 “기저세포암, 편평세포암, 악성흑색종 등에 관한 데이터를 학습해... ",http://www.edaily.co.kr/news/newspath.asp?newsid=02036886638790848,https://n.news.naver.com/mnews/article/018/0005673836?sid=105
18,2024-02-15 09:48:00,"영산대 법학과 외국인 유학생, 인니서 '검사' 임용","이스마일 동문은 &quot;8차례의 글로벌 세미나와 데이터‧사이버‧<b>인공지능</b> 등 선진화된 법체계를 인도네시아법과 비교하며, 학습한 것이 큰 도움이 됐다&quot;며 &quot;또 영산대 재학시절, 부산에서 진행된 국제 행사의 연사 참여... ",https://www.gukjenews.com/news/articleView.html?idxno=2921937,https://www.gukjenews.com/news/articleView.html?idxno=2921937
19,2024-02-15 09:48:00,"한투운용 &quot;'AI 5대장 투자' ACE 메타버스 ETF, 1년 수익률 61%&quot;",이투데이=윤혜원 기자 | 한국투자신탁운용은 ‘ACE 글로벌메타버스테크액티브 상장지수펀드(ETF)’를 통한 미국 <b>인공지능</b>(AI) 5대 종목 분산투자가 가능하다고 15일 밝혔다. 이른바 ‘AI5’는 매그니피센트7(M7)... ,https://www.etoday.co.kr/news/view/2331110,https://www.etoday.co.kr/news/view/2331110
20,2024-02-15 09:48:00,【데일리 ESG정책 브리핑】 2월15일,이날 회의에서는 ▲글로벌 통상규범 변화와 대응방안 ▲<b>인공지능</b>(AI) 규범과 글로벌 패권경쟁 ▲기후변화 등 환경과 통상규범 연계동향 등 세 가지 주제에 대해 발제와 토론을 진행했다. 정부는 그간 기후·환경... ,http://www.impacton.net/news/articleView.html?idxno=10878,http://www.impacton.net/news/articleView.html?idxno=10878
21,2024-02-15 09:48:00,"현대해상-SK텔레콤, AI기술 기반 보험 비즈니스 혁신 나선다","현대해상은 SK텔레콤과 AI(<b>인공지능</b>) 기술을 활용해 보험 비즈니스 혁신을 공동으로 추진하기 위한 전략적 제휴(MOU)를 체결했다고 15일 밝혔다. 협약식은 전날 정경선 현대해상 CSO(최고지속가능책임자), 유경상 SKT CSO... ",http://www.dailyimpact.co.kr/news/articleView.html?idxno=111341,http://www.dailyimpact.co.kr/news/articleView.html?idxno=111341
22,2024-02-15 09:47:00,"구글 꺾은 ‘시총 3위’ 이 남자들 합작품인데…돌연 갈라선 관계, 삼성·SK에...","앞서 올트먼은 지난달 말 한국을 방문해 삼성전자 경영진과 <b>인공지능</b>(AI) 사업 관련 협력 방안을 논의한 것으로 전해집니다. 다만, TSMC와 인텔이라는 복병을 잊어서는 안됩니다. 현재 최첨단 AI 반도체를 제조할 수... ",http://news.heraldcorp.com/view.php?ud=20240215050147,https://n.news.naver.com/mnews/article/016/0002266846?sid=101
23,2024-02-15 09:47:00,"마이크로소프트, '빌드2024' 5월21일 시애틀서 개최",올해 행사는 '<b>인공지능</b>(AI)'과 '마이크로소프트 코파일럿'의 무대일 것으로 예상된다. 마이크로소프트 빌드2024 일정 확정 공지 작년 빌드2023에서 마이크로소프트는 코파일럿 스튜디오와 윈도 AI 스튜디오 등 각종 AI... ,https://zdnet.co.kr/view/?no=20240215094549,https://n.news.naver.com/mnews/article/092/0002321360?sid=105
24,2024-02-15 09:47:00,"메타, 반도체·에너지 전문가 영입…&quot;AGI 개발 큰 힘 기대&quot;",메타는 두 사람이 범용<b>인공지능</b>(AGI) 개발에 큰 도움이 될 것이란 입장이다. 15일 CNBC 보도에 따르면 이날 메타는 “호크 탄 브로드컴 CEO와 엔론 임원 출신 존 아놀드가 이사회에 합류한다”고 밝혔다. 메타 이사회에... ,https://zdnet.co.kr/view/?no=20240215073601,https://n.news.naver.com/mnews/article/092/0002321361?sid=105
25,2024-02-15 09:46:00,"KT, 전 직급 대상 디지털 혁신 전문 인재 채용 전격 실시","먼저, 2022년 3월 한양대학교와 손잡고 채용을 전제로 한 AI 응용학과 석사과정을 신설, 이어 2023년부터는 KAIST와 포항공대에도 ‘KT <b>인공지능</b> 석사과정’을 개설해 운영하고 있다. 해당 과정은 전일제로 2년간 운영되는... ",http://www.mtnews.net/news/view.php?idx=17945,http://www.mtnews.net/news/view.php?idx=17945
26,2024-02-15 09:46:00,"영산대 법학과 외국인 유학생, 인도네시아서 검사 임용","이스마일 동문은 “8차례의 글로벌 세미나와 데이터·사이버·<b>인공지능</b> 등 선진화된 법체계를 인도네시아법과 비교하며 학습한 것이 큰 도움이 됐다”며 “또한 영산대 재학시절, 부산에서 진행된 국제 행사의 연사... ",http://www.betanews.net:8080/article/1459454.html,http://www.betanews.net:8080/article/1459454.html
27,2024-02-15 09:46:00,[생생르포] “디지털 사각지대 없앤다”…우리은행의 ‘어르신 IT배움터’ 가...,우선 SK텔레콤의 태블릿 화면을 탑재한 <b>인공지능</b>(AI) 스피커인 누구 네모(NUGU NEMO)가 놓여 있다. 그 옆에는 어르신들이 쉽게 이용해볼 수 있도록 커다란 글자로 사용법을 적어놓은 종이를 코팅해서 붙여 놓았다.... ,https://www.cnbnews.com/news/article.html?no=643412,https://www.cnbnews.com/news/article.html?no=643412
28,2024-02-15 09:46:00,"에이모, AI·데이터바우처 지원사업 공급기업 6년 연속 선정",<b>인공지능</b>(AI) 데이터 플랫폼 에이모(AIMMO)가 6년 연속 ‘2024 AI 바우처 지원사업’ 및 ‘2024 데이터바우처 지원사업’의 공급기업으로 선정돼 수요기업을 모집한다고 15일 밝혔다. ‘2024 AI 바우처 지원사업’은... ,https://biz.chosun.com/industry/company/2024/02/15/4EVMJI6NFNAXTK4JP7FXZ7JL2I/?utm_source=naver&utm_medium=original&utm_campaign=biz,https://n.news.naver.com/mnews/article/366/0000970493?sid=101
29,2024-02-15 09:45:00,"이에이트, 청약 경쟁률 381대 1…증거금 1조 이상 몰려",자체 개발한 NDX PRO는 데이터 기반의 디지털 트윈 플랫폼으로 <b>인공지능</b>(AI)·사물인터넷(IoT)·클라우드·3D 가시화 등 다양한 요소 기술을 통합해 사용자 맞춤형 디지털 트윈 환경을 제공한다. 이에이트는 재난재해... ,https://www.dailian.co.kr/news/view/1328524/?sc=Naver,https://n.news.naver.com/mnews/article/119/0002799739?sid=101
30,2024-02-15 09:44:00,인도 스타트업 ‘콰고스’…‘모드심’ 기술로 화물 전용 이륜차 플랫폼 개발,"올해로 25주년을 맞이하는 3D익스피리언스 월드 2024에서는 다양한 패널 발표와 기술 및 교육 세션, 네트워킹을 통해 <b>인공지능</b>과 디지털 트랜스포메이션 등 설계 및 제조에 관한 최신 주제들을 공유하고 관련 전략을... ",https://www.donga.com/news/It/article/all/20240215/123527409/1,https://n.news.naver.com/mnews/article/020/0003548119?sid=105
31,2024-02-15 09:44:00,[ET라씨로] 작년 연매출 8조원 돌파한 카카오…장초반 주가 강세,ET라씨로는 <b>인공지능</b>(AI) 기반으로 선별·분석한 주식 정보와 종목 매매 신호를 제공하는 전자신문 증권 정보 애플리케이션입니다. 플레이스토어에서 'ET라씨로'(-〉바로가기)를 다운로드하면 IT기업 뉴스와 시장... ,https://www.etnews.com/20240215000044,https://n.news.naver.com/mnews/article/030/0003181052?sid=101
32,2024-02-15 09:44:00,"목암생명과학硏-이화여대, AI 기반 신약개발 연구 MOU",목암생명과학연구소는 이화여자대학교와 '<b>인공지능</b> 알고리즘을 이용한 신약개발 협력 연구'를 위한 업무협약을 체결했다고 15일 밝혔다. 협약식은 13일 오후 서울 서초동에 위치한 목암연구소에서 김선 소장 및 신현진... ,http://www.newsdream.kr/news/articleView.html?idxno=53922,http://www.newsdream.kr/news/articleView.html?idxno=53922
33,2024-02-15 09:44:00,"진격의 엔비디아, 주가 2.5% 올라‥하루만에 미 시총 4위→3위","<b>인공지능</b>, AI 반도체 대장주 엔비디아가 강력한 주가 상승세를 이어가며 미국 상장기업 중 시가총액 3위 자리에 올랐습니다. 현지시간 14일 미 뉴욕증시에서 엔비디아 주가는 전장보다 2.46% 오른 739달러에... ",https://imnews.imbc.com/news/2024/world/article/6571354_36445.html,https://n.news.naver.com/mnews/article/214/0001330722?sid=104
34,2024-02-15 09:44:00,"톤워크, 820가지 옵션의 ‘비건 200+ 파운데이션’ 출시",아모레퍼시픽의 뷰티테크 기반 맞춤형 메이크업 전문 브랜드 톤워크(TONEWORK)가 ‘비건 200+ 파운데이션’을 새롭게 선보인다고 15일 밝혔다.톤워크 맞춤 파운데이션은 <b>인공지능</b>(AI) 기반의 컬러 진단과 조색 알고리즘에... ,http://www.yakup.com/news/index.html?mode=view&cat=12&nid=290494,http://www.yakup.com/news/index.html?mode=view&cat=12&nid=290494
35,2024-02-15 09:44:00,"SKT·현대해상, AI 활용한 보험 비즈니스 혁신 공동 추진","SK텔레콤(SKT)과 현대해상이 <b>인공지능</b>(AI) 기술을 활용해 보험 비즈니스 혁신을 공동으로 추진하기 위한 전략적 제휴(MOU)를 체결했다고 밝혔다. 협약식은 14일 유경상 SK텔레콤 최고전략책임자(CSO), 정경선 현대해상... ",https://it.chosun.com/news/articleView.html?idxno=2023092110236,https://it.chosun.com/news/articleView.html?idxno=2023092110236
36,2024-02-15 09:44:00,"[칩 인사이드]7조달러로 엔비디아-TSMC에서 벗어나려는 올트먼, 韓에 큰 기회...",샘 올트먼 오픈AI CEO./ 사진제공=뉴시스생성형 <b>인공지능</b>(AI) 챗GPT 개발로 소프트웨어 영역의 최고에 오른 오픈AI의 샘 올트먼 최고경영자(CEO)가 자체 AI 반도체 생산망 구축에 나선 배경에 관심이 집중되고 있다.... ,https://news.mtn.co.kr/news-detail/2024021416354311198,https://news.mtn.co.kr/news-detail/2024021416354311198
37,2024-02-15 09:44:00,"목암연구소-이화여대, AI 기반 신약개발 연구 MOU",GC 제공 목암생명과학연구소는 이화여자대학교와 '<b>인공지능</b> 알고리즘을 이용한 신약개발 협력 연구'를 위한 업무협약을 체결했다고 15일 밝혔습니다. 협약식은 지난 13일 서울 서초동에 위치한 목암연구소에서 김선... ,https://www.newsclaim.co.kr/news/articleView.html?idxno=3027637,https://www.newsclaim.co.kr/news/articleView.html?idxno=3027637
38,2024-02-15 09:44:00,[이 특징주 버핏이라면] 카카오 '어닝 서프라이즈'에 7%대 급등,카카오 측은 &quot;카카오톡과 AI(<b>인공지능</b>)의 결합을 통해 긍정적인 이용자 경험을 확대하겠다&quot;며 &quot;이를 바탕으로 광고 및 커머스 등 카카오의 핵심 비즈니스의 성장이 지속적으로 이어질 수 있도록 선순환 구조를 굳건히... ,https://www.news2day.co.kr/article/20240215500055,https://www.news2day.co.kr/article/20240215500055
39,2024-02-15 09:44:00,갤럭시S24 카메라 기능 '인스턴트 슬로모'…갤럭시S23·플립5·폴드5 지원,"인스턴트 슬로모는 기본 슬로모 모드에서 비디오를 녹화하지 않아도 <b>인공지능</b>(AI)을 기반으로 일반 비디오를 슬로우 모션 클립으로 바꿀 수 있는 기능이다. 인스턴트 슬로모 기능은 갤럭시S23, 갤럭시S23... ",https://kbench.com/?q=node/252736,https://kbench.com/?q=node/252736
40,2024-02-15 09:43:00,[카카오 컨콜] 카카오톡 '오픈채팅' 탭에 매일 1200만명 방문,홍 대표는 &quot;최근 전 국민이 생활 속에서 <b>인공지능</b>(AI)을 경험할 수 있도록 카카오톡과 AI를 결합하는 실험을 진행하고 있다&quot;며 &quot;카카오브레인이 개발한 경량화 언어모델 기반으로 채팅방에 읽지 않은 메시지 요약... ,http://www.fnnews.com/news/202402150925144689,https://n.news.naver.com/mnews/article/014/0005142494?sid=105
41,2024-02-15 09:42:00,"목암생명과학연구소, AI 기반 신약개발 연구 강화... 이화여자대학교와 맞손",﻿각종 <b>인공지능</b> 알고리즘을 기반으로 한 신약개발 연구활동 협력 목암생명과학연구소는 <b>인공지능</b> 기반의 신약개발 역량 강화를 위해 이화여자대학교와 산학협력에 나선다. 목암생명과학연구소는 이화여자대학교와... ,https://www.youthdaily.co.kr/news/article.html?no=145607,https://www.youthdaily.co.kr/news/article.html?no=145607
42,2024-02-15 09:42:00,"[특징주] 카카오, 연간 매출 첫 8조원 돌파에 7%대 강세",카카오는 향후 카카오톡과 <b>인공지능</b>(AI)의 결합을 통해 긍정적인 이용자 경험을 확대하고 이를 바탕으로 광고·커머스 등 카카오의 핵심 비즈니스의 성장이 이어질 수 있도록 선순환 구조를 굳건히 한다는... ,https://www.dailian.co.kr/news/view/1328508/?sc=Naver,https://n.news.naver.com/mnews/article/119/0002799735?sid=101
43,2024-02-15 09:42:00,"&quot;AI 사업 전략 공유&quot;···한컴, 'AI 테크데이' 개최","한글과컴퓨터(030520)가 '<b>인공지능</b>(AI) 테크데이' 행사를 진행했다. AI 테크데이는 한컴이 추진 중인 AI 사업의 방향성과 전략, 기술개발 현황 등을 임직원 간에 적극 공유·소통하고자 마련한 자리다. 지난해 한컴에서... ",https://www.news1.kr/articles/5321130,https://n.news.naver.com/mnews/article/421/0007352169?sid=105
44,2024-02-15 09:42:00,"[카카오컨콜] 홍은택 “카카오의 전방위적 쇄신 노력, 관심 있게 봐달라”",최근에는 카카오톡 이용자가 생활 속에서 <b>인공지능</b>(AI)을 경험할 수 있도록 카카오톡과 AI를 결합하는 실험을 진행 중이다. 지난해 12월 카카오브레인이 개발한 경량화 언어 모델을 기반으로 채팅방에 읽지 않은 메시지... ,https://www.ddaily.co.kr/page/view/2024021509384432660,https://n.news.naver.com/mnews/article/138/0002166847?sid=105
45,2024-02-15 09:42:00,"한국국학진흥원, 고문헌 번역 인재 양성","<b>인공지능</b> 이 인간의 많은 일과 일자리를 앗아간다고 하지만, 인간의 내적 섬세함과 고도의 전문력과 정확성이 요구되는 것까지 해내기는 아직 어려운 실정이다. 또한 전통기록유산은 사회적·지역적 특성이 강하게... ",https://www.ekn.kr/web/view.php?key=20240215022558160,https://www.ekn.kr/web/view.php?key=20240215022558160
46,2024-02-15 09:41:00,예스티 &quot;HBM 필수 장비 등 반도체 수주 호조로 '본원사업 흑자전환' &quot;,예스티 관계자는 &quot;작년 하반기 HBM 장비 첫 수주 이후 반도체 장비 분야 역대 최대 수주액을 달성해 지난해 턴어라운드에 성공했다&quot;며 &quot;<b>인공지능</b>(AI) 기업들의 HBM 수요 확대에 따라 올해에도 HBM용 장비 수주는 지속될... ,https://www.newspim.com/news/view/20240215000247,https://www.newspim.com/news/view/20240215000247
47,2024-02-15 09:41:00,"'너를 만났다 4', 기술은 더하고 신파는 덜었다","AI(<b>인공지능</b>)의 방송가 진출은 어제오늘 이야기가 아니다. 이미 많은 프로그램이 AI의 도움을 빌리고 있기에, 이제 단순히 프로그램에 AI가 참여한다는 사실만으로는 시청자들의 관심을 얻지 못한다. '너를 만났다'는... ",https://www.ize.co.kr/news/articleView.html?idxno=60076,https://n.news.naver.com/mnews/article/465/0000007621?sid=106
48,2024-02-15 09:41:00,"SK C&amp;C, 메리츠증권에 'AI 트레이딩' 솔루션 제공",SK(034730) C&amp;C는 메리츠증권에 고객 맞춤형 <b>인공지능</b> (AI) 주식 주문 최적화 서비스 ‘마켓캐스터 AI 트레이딩’을 제공한다고 15일 밝혔다. 마켓캐스터 AI트레이딩은 금융에 특화된 AI 모델링을 통해 △투자 시장 위험... ,http://www.edaily.co.kr/news/newspath.asp?newsid=02004086638790848,https://n.news.naver.com/mnews/article/018/0005673821?sid=105
49,2024-02-15 09:40:00,"&quot;AI 활용해 보험서비스 고객가치 혁신한다&quot;...현대해상, SKT와 AI 기반 보험 ...",정경선 현대해상 CSO(왼쪽)와 유경상 SKT CSO가 지난 14일 서울 을지로 SKT타워에서 <b>인공지능</b>(AI) 기술을 활용해 보험 비즈니스 혁신을 공동으로 추진하기 위한 전략적 제휴(MOU)를 체결했다. [사진 현대해상]... ,https://www.nbntv.kr/news/articleView.html?idxno=87400,https://www.nbntv.kr/news/articleView.html?idxno=87400
50,2024-02-15 09:40:00,"SK C&amp;C, AI로 최적 매수∙매도 트레이딩 서비스",AI(<b>인공지능</b>) 주식 주문 최적화 서비스 ‘마켓캐스터 AI 트레이딩’을 제공한다고 밝혔다. 마켓캐스터 AI트레이딩은 금융에 특화된 AI 모델링을 통해 △투자 시장 위험 분석 △마켓 모멘텀 포착 △거래비용 최소화 등을... ,https://www.news2day.co.kr/article/20240215500025,https://www.news2day.co.kr/article/20240215500025
