cnt,pdate,title,description,org_link,link
498,2024-02-14 23:16:00,"현대오토에버 스마트홈 플랫폼, 누적 적용 10만 세대 달성","지난 2018년 출시된 현대오토에버 '리빙&amp;라이프 스마트홈 플랫폼'은 <b>인공지능</b>(AI), 사물인터넷(IoT) 기술을 활용해 가전, 홈 네트워크, 단지 공용부, 커뮤니티 센터 등을 연결하며 다양한 서비스를 제공한다. 모바일 앱을... ",https://www.digitaltoday.co.kr/news/articleView.html?idxno=505920,https://www.digitaltoday.co.kr/news/articleView.html?idxno=505920
499,2024-02-14 22:50:00,세계 최대 규모 수면다원검사 데이터셋 구축…이미지 기반 <b>인공지능</b> 알고리즘...,"서울대병원 신현우 교수 · 한림대 춘천성심병원 김동규 교수팀은 세계 최대 규모인 1만 253건의 수면다원검사 데이터셋을 구축하고, 이 중 7,745건의 데이터를 활용해 ‘이미지 기반 의료 <b>인공지능</b> 알고리즘’을... ",https://medicalworldnews.co.kr/news/view.php?idx=1510959638,https://medicalworldnews.co.kr/news/view.php?idx=1510959638
500,2024-02-14 22:49:00,"디스플레이 ‘고마워, 갤럭시 S24·아이폰15’",<b>인공지능</b>(AI) 기능을 탑재한 이번 갤럭시 S24 시리즈는 사전판매량 121만대를 기록하며 갤럭시 S 시리즈 중 역대 최고 기록을 세운 바 있다. 시장에서는 올 1분기 갤럭시 S24 판매량을 전작 대비 66% 증가한 1200만대로... ,https://www.khan.co.kr/economy/economy-general/article/202402142247005,https://n.news.naver.com/mnews/article/032/0003279032?sid=101
501,2024-02-14 22:47:00,"경북도, AI 벤처 지원...2년간 특허출원 18건",‘중소벤처기업 AI 기술 융합 Scale-up 사업’은 경상북도가 지난 2022년부터 지역 <b>인공지능</b> 기반 중소벤처 기업의 R&amp;D 역량을 강화하기 위해 시작했다. 2026년까지 5년간 기업 발굴과 기술개발 지원으로 도내 <b>인공지능</b>... ,https://www.hankyung.com/article/202402144275h,https://n.news.naver.com/mnews/article/015/0004948502?sid=105
502,2024-02-14 22:45:00,"난 잊은 그 일, 챗GPT는 기억한다?",생성형 <b>인공지능</b>(AI) 챗봇인 챗GPT에 사용자가 입력한 내용을 ‘기억(메모리)’할 수 있는 기능이 추가된다. 이전 대화를 활용하면 답변에 시간을 줄이고 정확성도 높일 수 있지만 개인정보 침해 문제가 뒤따를 수 있다.... ,https://www.khan.co.kr/economy/economy-general/article/202402142244005,https://n.news.naver.com/mnews/article/032/0003279024?sid=101
503,2024-02-14 22:32:00,"SK네트웍스, 지난해 영업이익 2373억 원…33.6% 성장",SK매직은 렌탈 사업 중심으로 조직구조를 개편하고 AI(<b>인공지능</b>) 기반의 제품·서비스 기업으로서의 성장전략을 수립했다. SK렌터카는 중고차 해외판매 채널 확대로 영업성과를 창출했고 '월 단위 렌터카'와 'B2C... ,https://www.newsfreezone.co.kr/news/articleView.html?idxno=547959,https://www.newsfreezone.co.kr/news/articleView.html?idxno=547959
504,2024-02-14 22:30:00,안랩-네이버클라우드 &quot;초대규모 AI '하이퍼클로바X' 기반 사업 협력&quot;,향후 양사는 각사가 보유한 AI(<b>인공지능</b>)·보안·클라우드 등 역량을 결합해 '하이퍼클로바X'를 기반으로 보안 솔루션 고도화를 진행해 나갈 계획이다. 또 보안과 클라우드 분야에서 양사가 보유한 경쟁력을 결합해... ,http://www.enewstoday.co.kr/news/articleView.html?idxno=2090044,http://www.enewstoday.co.kr/news/articleView.html?idxno=2090044
505,2024-02-14 22:16:00,"상주시 내서면, 스마트팜 혁신밸리에서 첨단농업현장 견학","이날 회의에서는 스마트팜 혁신밸리 조성 취지에 대한 설명을 시작으로 스마트 농업시대를 맞이해 미래 농업 분야에서 경쟁력을 강화하기 위해 빅데이터, <b>인공지능</b> 등 첨단기술을 활용한 미래 첨단 농업시설을 견학하며... ",https://www.dkilbo.com/news/articleView.html?idxno=430886,https://www.dkilbo.com/news/articleView.html?idxno=430886
506,2024-02-14 22:16:00,"POSTECH 노준석 교수팀, 지속가능한 복사 냉각 기술 리뷰 논문 보고","POSTECH 제공 POSTECH 기계공학과·화학공학과 노준석 교수, <b>인공지능</b>대학원 소순애 연구원, 기계공학과 통합과정 윤주영·고병수·이다솔씨 연구팀은 친환경 에너지 기술인 복사 냉각의 기본 원리부터 생산 기술, 응용 분야... ",https://www.dkilbo.com/news/articleView.html?idxno=430875,https://www.dkilbo.com/news/articleView.html?idxno=430875
507,2024-02-14 22:12:00,달성군'AI 복지상담 시범사업'공모 선정,복지부 공모서 대구 유일 뽑혀 취약계층 관련 빅데이터 기반 위기가구 발굴 초기상담 진행 대구 달성군은 보건복지부 주관 2024년 <b>인공지능</b>(AI) 활용한 복지위기가구 발굴 초기상담 구축 시범사업에 대구에서 유일하게... ,https://www.dkilbo.com/news/articleView.html?idxno=430830,https://www.dkilbo.com/news/articleView.html?idxno=430830
508,2024-02-14 22:10:00,"미래에셋증권, DC·IRP 비원리금 상품 수익률 공개","이어 &quot;미래에셋증권은 사내 의사결정기구를 통해 우수한 상품을 선정하고, 전문인력과 AI(<b>인공지능</b>)기술을 통해 글로벌 포트폴리오를 제공하고 있다. 앞으로도 우량한 자산과 스마트한 글로벌 자산배분을... ",https://www.newsfreezone.co.kr/news/articleView.html?idxno=547968,https://www.newsfreezone.co.kr/news/articleView.html?idxno=547968
509,2024-02-14 22:08:00,"MS &quot;北·러·中·이란 등 적대국들, 사이버 공격에 AI 이용 탐지해 방해&quot;","마이크로소프트(MS)가 14일 주로 이란과 북한, 그리고 그보다는 덜하지만 러시아와 중국 등 미국의 적대국들이 공격적 사이버 작전을 수행하거나 연구하기 위해 MS와 사업 파트너 오픈AI가 개발한 생성 <b>인공지능</b>(AI)을... ",http://www.newsis.com/view/?id=NISX20240214_0002626921&cID=10101&pID=10100,https://n.news.naver.com/mnews/article/003/0012373415?sid=104
510,2024-02-14 22:06:00,"윤재호 구미상의 회장, '이재용 회장 사법리스크 해소 촉구' 성명",스마트폰·전기차·<b>인공지능</b>·로봇 등으로 삶의 질을 확 바꿔버린 산업 역군과 기업인&quot;이라고 강조했다. 윤 회장은 &quot;특히 삼성전자는 반도체·휴대폰·디스플레이 등 대한민국 수출과 무역흑자 확대에 가장 큰 기여를 했고... ,https://www.dkilbo.com/news/articleView.html?idxno=430822,https://www.dkilbo.com/news/articleView.html?idxno=430822
511,2024-02-14 22:03:00,텐마인즈 “2024년 헬스케어 시장 키워드는 M.O.V.E…슬립테크 새 장 열겠다”,특히 <b>인공지능</b>(AI)을 통해 개인 맞춤형 움직임을 유도하여 건강 관리에 앞장선다. 실제로 인간의 신체는 계속해서 같은 자세를 취하고 있는 것보단 적절한 움직임이 있어야 건강한 상태를 유지할 수 있다. ‘관찰’도... ,http://www.segye.com/newsView/20240214516009?OutUrl=naver,https://n.news.naver.com/mnews/article/022/0003904346?sid=101
512,2024-02-14 21:58:00,&quot;지역 연결 강화해 남해안 발전 이룩&quot;,"이어서 현지 기업 및 인력의 의무 활용을 위한 'Local First' 일거리·일자리 제도 도입을 통해 소모성 예산을 활용한 인큐베이팅(마중물) 사업 발굴·지원, <b>인공지능</b> 등 첨단기술을 활용한 스마트 팜, 양식장, 축산 시설 및... ",http://www.gnmaeil.com/news/articleView.html?idxno=535258,http://www.gnmaeil.com/news/articleView.html?idxno=535258
513,2024-02-14 21:54:00,"서울디지털재단, '사람' 중심의 'SLW' 성공 개최 위해 사우디서 지원사격","사우디아라비아 왕국 관할 기관인 '사우디 데이터 및 <b>인공지능</b>청(이하 SDAIA)'과 피라 바르셀로나가 공동 주관하는 GSCF는 '더 나은 삶(A Better Life)'을 주제로 차세대 녹색도시 조성, 데이터 기반 스마트 도시 거버넌스... ",https://www.gukjenews.com/news/articleView.html?idxno=2921756,https://www.gukjenews.com/news/articleView.html?idxno=2921756
514,2024-02-14 21:42:00,"경북도-포항TP, ‘AI 기술 융합 Scale-up 사업’ 성과",'중소벤처기업 AI 기술 융합 Scale-up 사업'은 경상북도가 지난 2022년부터 지역 <b>인공지능</b> 기반 중소벤처 기업의 R&amp;D 역량을 강화하기 위해 시작했다. 2026년까지 5년간 기업 발굴과 기술개발 지원으로 도내 <b>인공지능</b>... ,https://www.ekn.kr/web/view.php?key=20240214028237712,https://www.ekn.kr/web/view.php?key=20240214028237712
515,2024-02-14 21:34:00,[총선 톡톡] 도태우 &quot;교육발전특구 사업 적극 유치&quot;,"체험과 놀이를 통해 수학과 과학 재능을 키우는 수리과학인재양성원, 유학생 및 미군부대 병사들과 함께 세계 문화를 경험하는 글로벌체험센터, <b>인공지능</b> 역량을 기르는 AI리터러시센터 등과 연계한다는 계획이다.",https://www.idaegu.co.kr/news/articleView.html?idxno=449941,https://www.idaegu.co.kr/news/articleView.html?idxno=449941
516,2024-02-14 21:32:00,"&quot;사람 판독 결과와 80% 이상 일치&quot;…수면 단계 나누는 AI, 한국서 개발","이에 연구팀은 세계 최대 규모인 1만253건의 수면다원검사 데이터셋을 구축하고, 이 가운데 7745건의 데이터를 활용해 '이미지 기반 의료 <b>인공지능</b> 알고리즘'을 개발했다. 이후 수면 단계 자동 판독 가능성을 분석했다.... ",http://news.mt.co.kr/mtview.php?no=2024021421150412681,https://n.news.naver.com/mnews/article/008/0004998763?sid=101
517,2024-02-14 21:30:00,AI가 빅데이터 수집해 고독사 예방한다,사진제공=울산 남구 울산시 남구가 1인 가구의 고독사 예방에 <b>인공지능</b>(AI)을 활용한 스마트 기술과 빅데이터를 접목한다. 남구 문종현 복지교육국장은 14일 구청 프레스센터에서 실시한 브리핑에서 &quot;1인 가구의... ,http://www.ujeil.com/news/articleView.html?idxno=342152,http://www.ujeil.com/news/articleView.html?idxno=342152
518,2024-02-14 21:24:00,"경북도, '중기 AI 기술융합 사업' 속속 성과",14일 경북도에 따르면 '중소벤처기업 AI 기술 융합 스케일 업 사업'은 경북이 지난 2022년부터 지역 <b>인공지능</b> 기반 중소벤처 기업의 R&amp;D 역량을 강화하기 위해 시작했다. 이 사업은 오는 2026년까지 5년 간 기업 발굴과... ,https://www.idaegu.co.kr/news/articleView.html?idxno=449897,https://www.idaegu.co.kr/news/articleView.html?idxno=449897
519,2024-02-14 21:24:00,"달성군, 대구 첫 'AI 복지상담' 구축 시동","대구 달성군은 보건복지부의 2024 <b>인공지능</b>(AI) 활용 복지위기가구 발굴 초기상담 구축 시범사업에 대구에서 유일하게 선정됐다고 14일 밝혔다. 이는 계절형 실업, 휴·폐업으로 인한 경제적 취약가구, 단전·단수·단가스... ",https://www.idaegu.co.kr/news/articleView.html?idxno=449906,https://www.idaegu.co.kr/news/articleView.html?idxno=449906
520,2024-02-14 21:24:00,"&quot;대구기업, 생성형 AI 적극 도입해야&quot;","대구지역 기업에도 이제는 생성형 AI(<b>인공지능</b>)를 활용해야 한다는 주장이 나왔다. 대구상공회의소는 14일 대구 그랜드호텔에서 지역 기관 단체장, 포럼 회원 등 150여 명이 참석한 가운데 '21세기 대구경제포럼 제271차... ",https://www.idaegu.co.kr/news/articleView.html?idxno=449903,https://www.idaegu.co.kr/news/articleView.html?idxno=449903
521,2024-02-14 21:24:00,"삼성전자, 경력사원 대거 채용","삼성전자가 <b>인공지능</b>(AI)과 반도체, 가전, 전장(자동차 전기·전자 장비) 등 거의 전 분야에 걸쳐 경력사원을 대거 채용한다. 사진=삼성전자/이코노텔링그래픽팀. 삼성전자가 <b>인공지능</b>(AI)과 반도체, 가전, 전장(자동차... ",http://www.econotelling.com/news/articleView.html?idxno=12945,http://www.econotelling.com/news/articleView.html?idxno=12945
522,2024-02-14 21:22:00,사법부 ‘AI 활용 연구’ 발목 잡은 ‘판결문 공개 제한’,"전세계적으로 <b>인공지능</b>(AI)의 사법 분야에서의 적용 가능성이 화두가 되고 있는 가운데, 한국 사법부도 AI를 활용하는 방안에 대한 연구에 박차를 가하고 있다. 다만 판결문 공개가 제한돼 연구 활성화의 발목을 잡는... ",https://www.lawtimes.co.kr/news/195865,https://www.lawtimes.co.kr/news/195865
523,2024-02-14 21:17:00,‘챗GPT’ 주역 올트먼 이번엔 AI반도체… 최대 9300조 실탄 준비,챗GPT 열풍 이후 <b>인공지능</b>(AI) 반도체 시장의 성장세에 가속도가 붙고 있다. AI 반도체 공급을 독점한 엔비디아 주가가 최근 1년간 200% 이상 급등했다. 샘 올트먼 오픈AI 최고경영자(CEO)는 AI 반도체 사업 관련 최대 7조... ,https://www.kmib.co.kr/article/view.asp?arcid=0924343896&code=11151400&cp=nv,https://n.news.naver.com/mnews/article/005/0001674037?sid=101
524,2024-02-14 21:16:00,"삼성전자, '초격차 경쟁력' 확보에 박차…경력사원 대거 채용","삼성전자가 <b>인공지능</b>(AI)과 반도체, 가전, 전장(자동차 전기·전자 장비) 등 사실상 전 분야에서 경력사원을 대거 채용한다. 이재용 삼성전자 회장이 연일 &quot;미래는 기술 인재의 확보와 육성에 달려 있다&quot;고 강조하는... ",https://www.goodnews1.com/news/articleView.html?idxno=431718,https://www.goodnews1.com/news/articleView.html?idxno=431718
525,2024-02-14 21:14:00,하고 싶은 일 찾아주는 데서 시작 인천을 교육 선도 도시로 탈바꿈,인천은 더 이상 교육 때문에 떠나가는 도시가 아닌 돌아오는 도시&quot;라며 &quot;앞으로 우리 사회는 생성형 <b>인공지능</b>(AI) 등장으로 인간과 자연 그리고 AI가 협업해 공존하며 살아야 하는 만큼 교육도 이에 대비해야 한다&quot;고... ,http://www.kihoilbo.co.kr/news/articleView.html?idxno=1072748,http://www.kihoilbo.co.kr/news/articleView.html?idxno=1072748
526,2024-02-14 21:14:00,도 1인 가구 지원에 8807억 투입 병원 안심동행·AI 말벗 등 서비스,"기호일보 - 아침을 여는 신문, KIHOILBO 경기도가 올해 사업비 8천807억 원을 들여 <b>인공지능</b>(AI) 노인말벗서비스, 주거안전 체크리스트 개발·보급 등 규모의 39개 과제로 163만 도내 1인가구를 지원한다. 도는 이런 내용을... ",http://www.kihoilbo.co.kr/news/articleView.html?idxno=1072820,http://www.kihoilbo.co.kr/news/articleView.html?idxno=1072820
527,2024-02-14 21:06:00,'테이트 모던' 프란시스 모리스 명예관장 이화여대 초빙 석좌교수로,"김은미 총장은 <b>인공지능</b>의 급격한 발전과 포스트휴먼 현상의 새로운 환경 안에서 이화여대 조형대학이 예술과 기술이 융합한 미래 사회의 창의 혁신 플랫폼을 구축하길 기대하며, 세계 최고의 예술 현장 경험과 인적... ",http://www.queen.co.kr/news/articleView.html?idxno=406350,http://www.queen.co.kr/news/articleView.html?idxno=406350
528,2024-02-14 21:04:00,"서울시?서울관광재단, 마이스 관광객 120만 명 목표… 마이스 산업 집중 지원...","※ 5대 핵심산업('24년 중점 추진) ①<b>인공지능</b>(AI)  ②로봇  ③바이오(Bio)  ④핀테크  ⑤창조(뷰티.패션.XR.게임.영화.웹툰 등) 또, 서울을 대표하는 세계적인 전시회로 잠재력이 있는 행사 중 올해 33건을 선정해 전문... ",http://www.ttlnews.com/article/biz_world/15466,http://www.ttlnews.com/article/biz_world/15466
529,2024-02-14 21:02:00,AI가 언어 자동 번역…회의도 영화처럼,<b>인공지능</b>이 목소리를 인식하고 발언하는 사람을 향해 카메라를 자동으로 비추기 때문이다. ‘시네마틱 회의’도 흥미롭다. 카메라 시점이 자동으로 전환돼 발언하는 사람이 자리에서 이동하면 카메라가 발언자를 그대로... ,https://www.mk.co.kr/article/10935114,https://n.news.naver.com/mnews/article/024/0000087464?sid=101
530,2024-02-14 20:58:00,"달성군, 복지위기가구 AI 활용 초기상담",대구 달성군은 보건복지부 주관 ‘2024년 <b>인공지능</b>(AI) 활용한 복지위기가구 발굴 초기상담 구축 시범사업’에 대구에서 유일하게 선정됐다고 밝혔다. 이번 복지위기가구의 신속한 발굴 및 지원을 위한 ‘<b>인공지능</b>(AI)... ,http://www.ksmnews.co.kr/news/view.php?idx=468089,http://www.ksmnews.co.kr/news/view.php?idx=468089
531,2024-02-14 20:58:00,"정부 '반도체·2차전지' 승부수…TK, 인재로 파이 키워라",특히 생성형 <b>인공지능</b>(AI) '챗GPT'를 만든 오픈 AI의 최고경영자(CEO) 샘 올트먼이 자체 AI 반도체 공급망 구축을 위해 최대 7조달러(약 9천300조원) 규모의 투자 유치에 나서 반도체 업계가 술렁이고 있다. 지난해 세계 반도체... ,https://www.imaeil.com/page/view/2024021420571146802,https://n.news.naver.com/mnews/article/088/0000862304?sid=101
532,2024-02-14 20:56:00,"경북도, 디지털 경제 대전환…AI 벤처육성 팔 걷었다",‘중소벤처기업 AI 기술 융합 Scale-up 사업’은 경북도가 지난 2022년부터 지역 <b>인공지능</b> 기반 중소벤처 기업의 R&amp;D 역량을 강화하기 위해 시작했다.2026년까지 5년간 기업 발굴과 기술개발 지원으로 도내 <b>인공지능</b>... ,http://www.ksmnews.co.kr/news/view.php?idx=468104,http://www.ksmnews.co.kr/news/view.php?idx=468104
533,2024-02-14 20:54:00,"경북도교육청, 칠곡도서관 신축 사업 본격화","특히, 청소년 특화 공간으로 <b>인공지능</b>(AI), AR, VR, MR 등 기술을 활용한 디지털 콘텐츠를 제공하고 체험-교육-활용을 통해 새로운 직업 체험과 지역사회에 기여할 수 있는 다양한 방안도 기획하고 있다. 인문학 도시인... ",http://www.ksmnews.co.kr/news/view.php?idx=468051,http://www.ksmnews.co.kr/news/view.php?idx=468051
534,2024-02-14 20:52:00,[월드 플러스] “<b>인공지능</b> 앵커 덕분에 고향 갔어요”,"중국 최대 명절인 춘제 기간에, <b>인공지능</b> 앵커가 뉴스 전체를 진행했다고 합니다. 실제 앵커의 진행과 비슷한지 다른지, 한번 만나보시죠. 지난 주말, 중국 항저우 방송의 뉴스 여자 앵커가 나와 다음에 나올 소식을... ",https://news.kbs.co.kr/news/pc/view/view.do?ncd=7890093&ref=A,https://n.news.naver.com/mnews/article/056/0011661910?sid=104
535,2024-02-14 20:50:00,"상주시 내서면 이장협, 첨단 농업현장 견학","이날 현장 견학은 스마트팜 혁신밸리 조성 취지에 대한 설명을 시작으로 스마트 농업시대를 맞아 미래 농업 분야에서 경쟁력을 강화하기 위해 빅데이터, <b>인공지능</b> 등 첨단기술을 활용한 미래 첨단 농업시설을 견학하고... ",http://www.ksmnews.co.kr/news/view.php?idx=468010,http://www.ksmnews.co.kr/news/view.php?idx=468010
536,2024-02-14 20:48:00,경북도 &quot;올해 정부 R&amp;D사업 8건 신청 국비 33억 확보 도전&quot;,14일 경북도에 따르면 지난 2022년부터 지역 <b>인공지능</b> 기반 중소벤처 기업의 R&amp;D 역량을 강화하기 위해 시작한 이 사업은 2026년까지 5년간 기업 발굴과 기술개발 지원으로 도내 <b>인공지능</b> 전문기업 40개 사를 집중적으로... ,http://www.kyongbuk.co.kr/news/articleView.html?idxno=4001093,http://www.kyongbuk.co.kr/news/articleView.html?idxno=4001093
537,2024-02-14 20:48:00,생태 정원도시 다음은 ‘K디즈니’… 순천의 도전은 계속된다 [지방기획],국가정원의 아날로그적 요소는 완성도를 더욱 높여가는 한편 <b>인공지능</b>(AI)과 애니메이션 등 디지털 요소를 가미해 ‘3대가 함께 즐길 수 있는 정원’으로 탈바꿈시킬 계획이다. 정원 내 ‘꿈의 다리’는 우주인도 구경... ,http://www.segye.com/newsView/20240212510874?OutUrl=naver,https://n.news.naver.com/mnews/article/022/0003904325?sid=102
538,2024-02-14 20:46:00,[월드 이슈] 5월 금리 인하 물건너 가나…비트코인은 ‘선전’,"<b>인공지능</b> 기술에 대한 기대감으로 AI의 대표적인 주식인 엔비디아는 종가 기준으로 아마존을 제치고 시가총액 4위에 올랐습니다. 엔비디아의 주요 제품은 게임용 PC에 들어가는 그래픽 카드인데요, 챗GPT 등 AI 개발이... ",https://news.kbs.co.kr/news/pc/view/view.do?ncd=7890091&ref=A,https://n.news.naver.com/mnews/article/056/0011661908?sid=104
539,2024-02-14 20:42:00,감사원 “도교육청 전광판 설치 위법 없다”,<b>인공지능</b>(AI)로봇 등 물품 구입과 관련해선 “연간 계획에 따라 학교별 수요 조사를 하고 물품선정위원회를 통해 구매했고 수의 계약으로 구매한 것을 두고 예산 낭비와 비리라고 단정할 수 없다”고 덧붙였다. 감사원의... ,http://www.kwangju.co.kr/article.php?aid=1707910800764475021,http://www.kwangju.co.kr/article.php?aid=1707910800764475021
540,2024-02-14 20:42:00,"도태우 예비후보, 대구 중·남구 교육 공약 발표","글로벌체험센터, <b>인공지능</b> 역량을 기르는 AI리터러시센터 등 을 담고 있다. 또 청소년 전인교육을 위해 중·남구 내 모든 학교에 교육연극(초등), 고전독서토론(중등), 영어저널(고등) 등 방과후 특별 프로그램을 전면 무상... ",https://www.newsfreezone.co.kr/news/articleView.html?idxno=548086,https://www.newsfreezone.co.kr/news/articleView.html?idxno=548086
541,2024-02-14 20:41:00,선거판 흔드는 ‘딥페이크’…빅테크 기업들 ‘공동 대응’,"소셜미디어 자료에 <b>인공지능</b> 기술을 더해 만든 가짜인데, 미 대선을 앞두고 기승을 부리자 빅테크 기업들이 공동대응하기로 했습니다. 임세흠 기자가 보도합니다. [리포트] 지난달 미국 뉴햄프셔 유권자들에게 바이든... ",https://news.kbs.co.kr/news/pc/view/view.do?ncd=7890087&ref=A,https://n.news.naver.com/mnews/article/056/0011661907?sid=104
542,2024-02-14 20:41:00,한화 3남 김동선 신사업 ‘푸드테크’ 키운다,"한화푸드테크 제공 푸드테크는 음식(Food)과 기술(Technology)의 합성어로 <b>인공지능</b>(AI), 3차원(3D)프린팅, 로봇 등 최첨단 기술을 식품산업 전반에 활용하는 사업 분야다. 한화그룹의 유통 서비스와 로봇 부문의 신사업... ",http://www.segye.com/newsView/20240214515136?OutUrl=naver,https://n.news.naver.com/mnews/article/022/0003904322?sid=101
543,2024-02-14 20:40:00,"경북도, 디지털 경제 대전환 시대…AI 벤처육성 ‘앞장’",‘중소벤처기업 AI 기술 융합 Scale-up 사업’은 경상북도가 지난 2022년부터 지역 <b>인공지능</b> 기반 중소벤처 기업의 R&amp;D 역량을 강화하기 위해 시작했다. 2026년까지 5년간 기업 발굴과 기술개발 지원으로 도내 <b>인공지능</b>... ,https://tk.newdaily.co.kr/site/data/html/2024/02/14/2024021400425.html,https://tk.newdaily.co.kr/site/data/html/2024/02/14/2024021400425.html
544,2024-02-14 20:36:00,AI 승자가 추천한 의외의 미래 전공,AI(<b>인공지능</b>) 반도체 시장의 90%를 장악한 엔비디아야말로 AI시대 최고 승자로 꼽히는 기업이다. ▶”나는 항상 30일 뒤 망한다고 생각하면서 일해왔다.” 대만계 미국인 젠슨 황 엔비디아 창업자의 말이다. 그는 친구... ,https://www.chosun.com/opinion/manmulsang/2024/02/14/25FEMO6LP5FJZEBR7FTTANDANY/?utm_source=naver&utm_medium=referral&utm_campaign=naver-news,https://n.news.naver.com/mnews/article/023/0003816666?sid=110
545,2024-02-14 20:34:00,부동산 침체가 이마트에 미친 영향… 작년 사상 첫 적자,또한 풀필먼트 운영 개선과 <b>인공지능</b>(AI) 광고 서비스 강화로 수익 확대를 도모한다. 이마트 관계자는 “오프라인 3사 기능 통합 시너지가 본격화되고 온라인사업 수익성이 개선되고 있어 올해 연말 사상 첫 연매출 30조... ,https://www.donga.com/news/Economy/article/all/20240214/123521385/1,https://n.news.naver.com/mnews/article/020/0003547971?sid=101
546,2024-02-14 20:32:00,“기업 해외진출 발판 마련·시민 참여 이스포츠 대회 추진”,"콘텐츠·ICT, 창업·기업경영 등 다양한 영역에서 25년 간 활동한 이 원장은 취임 직후 진흥원 고유기능을 살리는 데 집중한 조직개편을 단행, 경영체제를 안정화시키고 <b>인공지능</b> 혁신과 K-콘텐츠의 약진 등 글로벌... ",http://www.kjdaily.com/article.php?aid=1707908339622356004,http://www.kjdaily.com/article.php?aid=1707908339622356004
547,2024-02-14 20:32:00,공정위 “이통 3사 보조금 담합” vs 방통위 “규제영역 침범”,어느 기준을 따라야 할지 혼선을 겪고 있는 상황”이라며 “여기에 단통법 폐지 논란까지 더해지면서 성장이 정체된 통신시장에서 글로벌 AI(<b>인공지능</b>) 경쟁 등에 나서야 할 이통사들이 동력을 잃고 있다”고 지적했다.,http://www.segye.com/newsView/20240214515288?OutUrl=naver,https://n.news.naver.com/mnews/article/022/0003904314?sid=101
