cnt,pdate,title,description,org_link,link
747,2024-02-14 17:39:00,[신간] 추리소설로 철학하기·미래 법정,"차의 소유주일까, 차를 만든 제조사일까, 그것도 아니면 주행 프로그램을 만든 <b>인공지능</b>(AI) 회사일까. 인간의 몸은 어디까지 개조해도 될까. 생명 연장이 아닌 개인 만족을 목적으로 하는 신체 개조는 어디까지 허용해야... ",https://www.yna.co.kr/view/AKR20240214144300005?input=1195m,https://n.news.naver.com/mnews/article/001/0014505509?sid=103
748,2024-02-14 17:38:00,변방에서 'AI 허브' 꿈꾸는 깐느‧‧‧&quot;AI 붐은 이제 시작&quot;,그는 자신의 지역을 새로운 <b>인공지능</b>(AI) 메카라고 자부한다.[사진= 김요셉 기자] 루이 노아이유(Louis Noaille) 스타트업 연구원은 프랑스 남부 깐느에 거주하며 20분 남짓 집에서 떨어진 회사에 다닌다. 루이... ,http://www.hellodd.com/news/articleView.html?idxno=103369,http://www.hellodd.com/news/articleView.html?idxno=103369
749,2024-02-14 17:37:00,"[과기원NOW] GIST, 값비싼 질화갈륨 반도체 '무한 양산 기술' 개발 外","■ 포스텍은 노준석 기계공학과·화학공학과 노준석 교수와 소순애 <b>인공지능</b>대학원 연구원(현 고려대 전자기계융합공학과 교수) 연구팀이 친환경 에너지 기술인 복사 냉각의 기본 원리부터 생산 기술, 응용 분야... ",https://www.dongascience.com/news/view/63785,https://n.news.naver.com/mnews/article/584/0000025958?sid=105
750,2024-02-14 17:37:00,돈맥경화 스타트업…1년새 투자유치 52% 급감,그나마 올해에는 <b>인공지능</b>(AI) 또는 바이오 스타트업에는 투자가 이뤄질 것으로 예상된다. 실제로 AI 반도체 스타트업 리벨리온은 1650억 원 규모의 투자 유치에 성공했다고 지난달 말 발표했다. 누적 투자 유치액이... ,https://www.sedaily.com/NewsView/2D5CWL69AO,https://n.news.naver.com/mnews/article/011/0004299602?sid=101
751,2024-02-14 17:36:00,"뷰런, 제홍모 양산개발총괄 영입...ADAS 기술 강화·양산 목표","제홍모 총괄은 올라웍스, 인텔코리아, 스트라드비젼 등에서 20년 이상 현장 경험을 쌓아온 <b>인공지능</b>(AI) 전문가다. 특히 스트라드비젼에서는 ADAS를 위한 딥러닝 기반의 카메라 인식기술 양산을 성공시킨 바 있다. 제... ",https://www.aitimes.com/news/articleView.html?idxno=157169,https://www.aitimes.com/news/articleView.html?idxno=157169
752,2024-02-14 17:36:00,[문화 속 산업이야기]“우리도 AI 기업 맞다니까요?”…AI 워싱의 탐욕,"교통사고로 부모를 잃고 혼자가 된 ‘케이디’는 <b>인공지능</b>(AI) 로봇 ‘메간’과 둘도 없는 단짝이다. ‘메간’은 로봇 엔지니어인 케이디의 이모가 선물했다. 부모를 잃은 케이디의 마음을 치유하고, 자신도 미숙한... ",https://kidd.co.kr/news/235709,https://kidd.co.kr/news/235709
753,2024-02-14 17:36:00,[스타트업 스트리트]기술력 하나로 M&amp;A·자금 조달…투자자 몰리는 '연구실 창...,<b>인공지능</b>(AI) 등 첨단 분야에서도 ‘연구실 창업 기업’의 약진 흐름은 거세다. 광주과학기술원(GIST) 전기전자컴퓨터학과 석사 출신 빈준길 대표가 이끄는 뉴로핏은 지난해 11월 200억 원 규모의 시리즈C 라운드 투자... ,https://www.sedaily.com/NewsView/2D5CWVV5W0,https://n.news.naver.com/mnews/article/011/0004299599?sid=101
754,2024-02-14 17:36:00,반도체 ETF 세대교체 …'필·반' 지고 '소부장·AI' 뜬다,대표 인덱스 추종 상품을 선호하던 과거와 달리 최근에는 <b>인공지능</b>(AI) 특수로 수혜 분야가 세분화됨에 따라 테마형 상품이 시장에서 인기를 끌고 있다. 14일 한국거래소에 따르면 개인투자자들은 미국의... ,https://www.mk.co.kr/article/10942665,https://n.news.naver.com/mnews/article/009/0005258558?sid=101
755,2024-02-14 17:34:00,&quot;韓의 버추얼트윈 혁신 손꼽혀…사업 확대 이어갈 것&quot;[3D익스피리언스월드 20...,바씨 부사장은 “직접회로의 복잡도가 지수함수적으로 높아지는 동시에 <b>인공지능</b> 열풍이 반도체 수요를 높이며 현재 반도체 업계는 정밀도와 속도라는 두 측면을 모두 잡아야 하는 상황”이라며 “버추얼 트윈 기반의... ,https://www.sedaily.com/NewsView/2D5CW6YQN4,https://n.news.naver.com/mnews/article/011/0004299594?sid=105
756,2024-02-14 17:34:00,"kt cs, 23년 매출 6352억원 기록…최대 실적","특히 컨택사업은 가파르게 성장하고 있는 <b>인공지능</b> 컨택센터(AICC) 시장에서 경쟁력을 확보하기 위해 과감한 투자와 역량 강화에 총력을 기울여 AI경쟁력을 한 단계 높였으며, AICC Total Outsourcing BPO(Business... ",https://www.nspna.com/news/?mode=view&newsid=682669,https://www.nspna.com/news/?mode=view&newsid=682669
757,2024-02-14 17:34:00,"SK네트웍스, 지난해 영업익 34% 신장…배당 늘리고 자사주 소각도",SK매직의 경우 렌탈 사업 중심으로 조직구조를 개편하고 AI(<b>인공지능</b>) 기반의 제품·서비스 기업으로 진화하겠다는 성장전략을 수립했다. 이와 함께 지난해 4분기 국내 최초로 팬까지 세척 가능한 '올클린 디 아트... ,http://www.updownnews.co.kr/news/articleView.html?idxno=307217,http://www.updownnews.co.kr/news/articleView.html?idxno=307217
758,2024-02-14 17:34:00,"[ASIA Biz] '베트남 대표 IT 기업' FPT그룹, 해외 매출 50억 달러 포부","그러면서도 &quot;AI, 반도체, 자동차의 핵심 기술에 집중하고 정부의 대형 프로젝트에 참여할 것&quot;이라며 “<b>인공지능</b>(AI) 분야에 대한 많은 특허와 함께 지역 내 칩 서비스 제공업체로 거듭날 계획이고, 2030년까지... ",https://www.ajunews.com/view/20240213164429359,https://www.ajunews.com/view/20240213164429359
759,2024-02-14 17:34:00,"뷰런테크놀로지, AI 전문가 전 스트라드비젼 제홍모 CTO 전격 영입","이번에 뷰런에서 전격 영입한 제홍모 총괄은 올라웍스, 인텔코리아, 스트타비젼 등 20년 이상 국내외에서 현장 경험을 쌓아온 국내 최고 AI(<b>인공지능</b>)분야 전문가중 한 명이다. 특히, 최고기술책임자로 역임했던... ",https://www.dailysecu.com/news/articleView.html?idxno=153550,https://www.dailysecu.com/news/articleView.html?idxno=153550
760,2024-02-14 17:33:00,"[사이언스게시판] NST, <b>인공지능</b> 통합 교육 과정 운영 外",■ 국가과학기술연구회(NST)는 이달부터 정부출연연구기관과 과학기술정보통신부 직할 연구기관 재직자를 대상으로 <b>인공지능</b>(AI) 통합 교육을 운영한다고 14일 밝혔다. 올해 교육은 12대 국가전략기술을 반영한 'AI... ,https://www.dongascience.com/news/view/63784,https://n.news.naver.com/mnews/article/584/0000025957?sid=105
761,2024-02-14 17:33:00,"네이버, 메타버스 불황에도 '네이버제트' 힘 싣는 까닭","여기에 생성형 <b>인공지능</b>(AI)이 산업계의 새로운 트렌드로 떠오르며 관심사가 옮겨간 점도 크게 작용했다. 이 때문에 메타버스에 나섰던 기업들도 수익성을 이유로 투자 축소, 계열사 정리 등에 나서며 외면하기... ",https://www.topdaily.kr/articles/96476,https://www.topdaily.kr/articles/96476
762,2024-02-14 17:32:00,"도태우 예비후보, &quot;교육발전특구 사업 유치 추진&quot;...중·남구 교육 공약 발표","체험과 놀이를 통해 수학과 과학 재능을 키우는 수리과학인재양성원, 유학생, 미군부대 병사들과 함께 세계 문화를 경험하는 글로벌체험센터, <b>인공지능</b> 역량을 기르는 AI리터러시센터 등을 담고 있습니다. 또 청소년... ",https://news.bbsi.co.kr/news/articleView.html?idxno=3144333,https://news.bbsi.co.kr/news/articleView.html?idxno=3144333
763,2024-02-14 17:32:00,"이스트소프트-네이버클라우드, AI 휴먼·하이퍼클로바X 협력 MOU",이스트소프트(대표 정상원)는 네이버클라우드(대표 김유원)와 <b>인공지능</b>(AI) 휴먼 기술인 'AI 페르소' 및 대형언어모델(LLM) '하이퍼클로바X'와의 기술 제휴 및 공동사업 발굴을 위한 MOU를 체결했다고 14일 밝혔다. 이번... ,https://www.aitimes.com/news/articleView.html?idxno=157163,https://www.aitimes.com/news/articleView.html?idxno=157163
764,2024-02-14 17:31:00,"&quot;청년 취업, 끝까지 밀어 드립니다!&quot;..광주·전남 지원 '팍팍'","광주시는 청년카페 프로그램에 더해 광주<b>인공지능</b>사관학교(훈련), 메이커스페이스(창업), 청년드림은행(재무조정지원) 등 다양한 지원정책을 연계해 진행할 계획입니다. 전라남도는 청년 일자리카페 지원사업과 청년... ",https://www.ikbc.co.kr/article/view/kbc202402140055,https://n.news.naver.com/mnews/article/660/0000055565?sid=101
765,2024-02-14 17:31:00,교사 위한 '안심통화' 앱에도 AI 등장...학부모와 통화 요약해준다,KT가 서비스하고 있는 교사와 학생·학부모 간 소통 애플리케이션 '랑톡'에 <b>인공지능</b>(AI)을 활용한 통화 요약 및 정리 기능이 추가된다. KT는 새 학기가 시작되는 3월 랑톡에서 'AI 통화리포트' 서비스를 제공한다고... ,https://www.hankookilbo.com/News/Read/A2024021413450003763?did=NA,https://n.news.naver.com/mnews/article/469/0000785392?sid=101
766,2024-02-14 17:30:00,"삼성전자, 90여개 직무서 경력사원 대거 채용","모집 공고별로 보면 삼성리서치는 <b>인공지능</b>(AI) 관련 인재 영입에 나선다. 랭귀지 AI와 스피치 AI, 비전 AI 등의 분야에서 거대언어모델(LLM) 연구·개발, 멀티모달 생성형 AI 모델 연구·개발, 생성형 온디바이스 AI 기술... ",https://www.mediapen.com/news/view/896933,https://www.mediapen.com/news/view/896933
767,2024-02-14 17:30:00,"한예종 학생들이 선보이는 실감형 전시, 《미러드 우리(Mirrored Uri)》","의료와 <b>인공지능</b> 콘텐츠 분야의 글로벌 트렌드를 선도하고 있다. 전시는 누구나 무료로 관람할 수 있으며, 연계 전시와 프로그램을 포함한 상세 안내 및 개최 일정은 KF의 공식 웹사이트(kf.or.kr), 공식 SNS(인스타그램... ",http://www.sctoday.co.kr/news/articleView.html?idxno=42334,http://www.sctoday.co.kr/news/articleView.html?idxno=42334
768,2024-02-14 17:30:00,[칼럼] 고부가가치 산업으로 주목받는 농업회사법인,"또 로봇과 센서, <b>인공지능</b>을 기반으로 한 친환경 농법을 구축해 농산물의 가치를 끌어올리고 있다. 비전문가도 손쉽게 농작물을 재배할 수 있는 생육환경을 만들거나, 스마트팜 조성 등은 농업이 고부가가치 산업으로... ",http://www.wowtv.co.kr/NewsCenter/News/Read?articleId=A202402130055&t=NN,https://n.news.naver.com/mnews/article/215/0001148438?sid=101
769,2024-02-14 17:30:00,"서울시, 마이스 산업 집중 육성…90억원 투입","우선 참가자 3000명 이상의 중대형 행사와 <b>인공지능</b>(AI), 로봇, 바이오, 핀테크, 창조산업 등 서울시 5대 핵심산업과 관련한 마이스 행사를 집중 유치한다.서울을 대표하는 세계적인 전시회로 자리매김 할 행사 중 총... ",https://www.asiatoday.co.kr/view.php?key=20240214010006499,https://www.asiatoday.co.kr/view.php?key=20240214010006499
770,2024-02-14 17:30:00,"'팔방미인' 게이밍 헤드셋, 스틸시리즈 '아크티스 노바 7P 화이트'","특히 게임 업계 최초 'Pro-grade Parametric EQ'를 사용해 게임 내 발걸음이나 장전소리, 음성을 강조하는 한편 2세대 <b>인공지능</b>으로 작동되는 노이즈 캔슬링 소프트웨어로 소음을 25dB까지 차단하고, AI 노이즈 캔슬링... ",https://www.asiatoday.co.kr/view.php?key=20240214001723414,https://www.asiatoday.co.kr/view.php?key=20240214001723414
771,2024-02-14 17:30:00,"﻿﻿﻿﻿현대오토에버 스마트홈 플랫폼, 누적 적용 주택 10만 세대 달성","지난 2018년 출시된 리빙&amp;라이프 스마트홈 플랫폼은 <b>인공지능</b>(AI)과 사물인터넷(IoT) 기술을 활용해 가전, 홈 네트워크, 단지 공용부, 커뮤니티 센터 등을 연결하며 다양한 서비스를 제공한다. 모바일 앱을 통해... ",https://www.businesspost.co.kr/BP?command=article_view&num=342468,https://www.businesspost.co.kr/BP?command=article_view&num=342468
772,2024-02-14 17:30:00,"농촌진흥청 서효원 차장, 충남 금산 잎들깨 재배지에서 현장 목소리 들어","이를 활용해 잎들깨 재배실험과 생육 상황 정보 수집·축적, 최적 환기 제어 <b>인공지능</b> 모형 개발에 필요한 정보 수집 기반을 구축했다. 서효원 차장은 &quot;정부 정책에 힘입어 <b>지능</b>형 농장 면적 증가, 관련 시설·장비 구축 등... ",http://www.queen.co.kr/news/articleView.html?idxno=406338,http://www.queen.co.kr/news/articleView.html?idxno=406338
773,2024-02-14 17:28:00,김영진 &quot;초고령사회 대응 정책 시급&quot;,김 예비후보는 &quot;특히 <b>인공지능</b> 등을 기반으로 한 센서와 로봇 기반 돌봄 서비스 확대로 거동이 불편한 노인의 일상생활을 보조할 수 있도록 하겠다&quot;며 &quot;이에 따른 안전관리 요원 및 생활관리사 등의 돌봄 전문가와 가족의... ,http://www.newsjeju.net/news/articleView.html?idxno=396835,http://www.newsjeju.net/news/articleView.html?idxno=396835
774,2024-02-14 17:28:00,"세계 AI 석학 얀 르쿤, “고양이보다 못한 현 AI, 미래 종말 없다”",그는 “인간 수준의 <b>인공지능</b>(AI) 구현은 먼 얘기”라며 “머지 않은 미래에는 디지털 세계와 AI 시스템이 매개돼 모든 상호작용이 이뤄질 것”이라며 AI로 인한 종말은 없다고 단언했다. 얀 르쿤 부사장은 인간 인지... ,http://digitalchosun.dizzo.com/site/data/html_dir/2024/02/14/2024021480239.html,http://digitalchosun.dizzo.com/site/data/html_dir/2024/02/14/2024021480239.html
775,2024-02-14 17:28:00,김영진 예비후보 &quot;스마트 돌봄 사회 서비스 플랫폼 구축할 것&quot;,"김 예비후보는 &quot;특히 <b>인공지능</b> 등을 기반으로 한 센서와 로봇 기반 돌봄 서비스 확대로 거동이 불편한 노인의 일상생활을 보조하고, 안전관리 요원 및 생활관리사 등의 돌봄 전문가와 가족의 부담을 경감함으로써 돌봄... ",http://www.headlinejeju.co.kr/news/articleView.html?idxno=536276,http://www.headlinejeju.co.kr/news/articleView.html?idxno=536276
776,2024-02-14 17:28:00,"KT, 랑톡에 'AI 통화리포트' 새 기능 더해 소통업무 효율 증대",KT가 자사 애플리케이션 '랑톡'에 선생님들의 소통업무 효율을 크게 높여줄 <b>인공지능</b>(AI) 리포트 서비스를 새롭게 업데이트한다. KT는 새 학기가 시작되는 다음달부터 랑톡에서 'AI 통화리포트' 서비스를 제공한다고 14일... ,http://www.updownnews.co.kr/news/articleView.html?idxno=307216,http://www.updownnews.co.kr/news/articleView.html?idxno=307216
777,2024-02-14 17:27:00,&quot;AI인재들 삼성 오라&quot; 경력직원 대거 채용,"90여 개 직무에서 경력사원을 모집하는 대규모 채용으로, <b>인공지능</b>(AI) 분야 인재 모집에 적극적으로 뛰어든 것이 눈길을 끈다. 14일 삼성전자에 따르면 삼성전자 DX부문은 오는 26일까지 90여 개 직무에서 경력사원을... ",https://www.mk.co.kr/article/10942639,https://n.news.naver.com/mnews/article/009/0005258536?sid=105
778,2024-02-14 17:26:00,푸드테크 전문기업 한화푸드테크 출범 글로벌 시장 적극 공략,"푸드테크는 음식(Food)과 기술(Technology)의 합성어로 <b>인공지능</b>(AI), 3D프린팅, 로봇 등 최첨단 기술을 식품산업 전반에 활용하는 것을 말한다. 세계 최대 가전·IT 전시회 CES(Consumer Electronics Show)를 주관하는... ",http://www.lkp.news/news/articleView.html?idxno=43864,http://www.lkp.news/news/articleView.html?idxno=43864
779,2024-02-14 17:26:00,"유통업계, '마케팅부터 상품 추천까지'... AI 활용범위 확대","사진제공=롯데홈쇼핑  유통업계 내에 <b>인공지능</b>(AI) 활용 움직임이 확대되고 있다. AI를 마케팅에 접목해 활용할뿐 아니라 AI로 소비자, 판매자에게 맞춤형 상품을 제공하는 등 업무 효율성을 높이고 있다.... ",http://www.opinionnews.co.kr/news/articleView.html?idxno=94038,http://www.opinionnews.co.kr/news/articleView.html?idxno=94038
780,2024-02-14 17:26:00,"갤럭시S24 '잔상현상' 논란 불거져, 삼성전자 대응에 AI폰 흥행 유지 달려",<b>인공지능</b>(AI) 기술로 세계 프리미엄 스마트폰 시장에서 애플의 아성을 무너뜨리겠다는 회사의 구상이 뜻하지 않은 품질 문제로 발목이 잡힐 수 있다는 우려가 나오고 있다. 14일 전자업계에 따르면 일부 국내외... ,https://www.businesspost.co.kr/BP?command=article_view&num=342423,https://www.businesspost.co.kr/BP?command=article_view&num=342423
781,2024-02-14 17:26:00,서구도서관 'AI 동화책 만들기' 강좌,인천시교육청 서구도서관은 내달 8일부터 '<b>인공지능</b>(AI) 동화책 작가 탄생' 강좌를 5차례 운영한다고 14일 밝혔다. 이 강좌는 초등학교 3~6학년을 대상으로 AI를 활용해 글을 쓰고 그림을 그려 동화책을 만드는 수업이다.... ,https://www.incheonilbo.com/news/articleView.html?idxno=1234262,https://www.incheonilbo.com/news/articleView.html?idxno=1234262
782,2024-02-14 17:26:00,"삼성전자, DX부문 90여개 직무서 '경력사원' 채용","모집 공고별로 보면, 삼성리서치는 랭귀지 <b>인공지능</b>(AI), 스피치 AI, 비전 AI 등 AI 관련 분야에서 거대언어모델(LLM), 멀티모달 생성형 AI 모델, 생성형 온디바이스 AI 기술 등 분야의 연구·개발을 수행할 경력사원을... ",https://weekly.hankooki.com/news/articleView.html?idxno=7084356,https://weekly.hankooki.com/news/articleView.html?idxno=7084356
783,2024-02-14 17:25:00,"조상규 예비후보, 지역 고유의 특성 반영한 3대 비전 제시","이어, 현지 기업 및 인력 의무 활용을 위한 'Local First' 일거리·일자리 제도 도입을 통해, 소모성 예산을 활용한 인큐베이팅(마중물) 사업 발굴·지원, <b>인공지능</b> 등 첨단기술을 활용한 스마트팜, 양식장, 축산 시설 및 판매... ",http://www.enewstoday.co.kr/news/articleView.html?idxno=2090033,http://www.enewstoday.co.kr/news/articleView.html?idxno=2090033
784,2024-02-14 17:24:00,"예산군 평생학습관, 14일~27일 하반기 프로그램 수강생 모집","프로그램 △<b>인공지능</b> 대화생성기(chat GPT) △첫 출근 날부터 바로 쓰는 사무실(오피스) 문서 등 다양한 프로그램을 마련했다. 주민등록상 예산군민이면 누구나 1인 2강좌까지 신청이 가능하며, 실버 대상 프로그램을... ",http://www.aflnews.co.kr/news/articleView.html?idxno=265005,http://www.aflnews.co.kr/news/articleView.html?idxno=265005
785,2024-02-14 17:24:00,"서효원 농촌진흥청 차장, 충남 금산 잎들깨 재배 현장 방문","이를 활용해 잎들깨 재배실험과 생육 상황 정보 수집·축적, 최적 환기 제어 <b>인공지능</b> 모형 개발에 필요한 정보 수집 기반을 구축했다. 서효원 차장은 “정부 정책에 힘입어 <b>지능</b>형 농장 면적 증가, 관련 시설·장비 구축 등... ",http://www.newsam.co.kr/news/article.html?no=37169,http://www.newsam.co.kr/news/article.html?no=37169
786,2024-02-14 17:24:00,"세종시교육청, 디지털 기반 교육혁신 선도학교 25교로 확대 운영",세종시교육청 전경 14일 시교육청에 따르면 디지털 선도학교는 내년 도입 예정인 <b>인공지능</b>(AI) 디지털교과서 시행 전 에듀테크 프로그램을 활용한 교수·학습법을 학교에 적용해 성공적인 디지털 교육모델을 창출하고... ,http://www.aflnews.co.kr/news/articleView.html?idxno=264980,http://www.aflnews.co.kr/news/articleView.html?idxno=264980
787,2024-02-14 17:23:00,"원티드랩, 작년 영업익 16억원...전년 대비 82%↓",커리어맵은 대규모 언어 모델(LLM)과 <b>인공지능</b>(AI) 매칭 기술을 적용해 사용자 개개인의 개별 직무 및 연차에 따른 향후 커리어를 전망한다. 사용자가 목표 연봉을 설정하면 본인 역량을 바탕으로 도전할 수 있는... ,https://zdnet.co.kr/view/?no=20240214123055,https://n.news.naver.com/mnews/article/092/0002321303?sid=105
788,2024-02-14 17:22:00,마이크로소프트가 뽑은 2024 AI 트렌드…'소형·멀티모달·과학',마이크로소프트(MS)는 '2024년 주목해야 할 주요 <b>인공지능</b>(AI) 트렌드 3가지'를 14일 밝혔다. MS는 소형언어모델(SLMs)이 AI 분야에서 더욱 중요한 역할을 하게 될 것으로 예상했다. 수십억 개의 매개변수(파라미터)로 이뤄진... ,https://www.news1.kr/articles/5320742,https://n.news.naver.com/mnews/article/421/0007351423?sid=105
789,2024-02-14 17:22:00,"강준석 BPA 사장 &quot;초연결시대 주도, 글로벌 종합항만서비스 리더&quot; 도약","현대 사회의 시민들은 원하는 내용을 말하기만 하면 <b>인공지능</b>이 무엇이든 답해주는 첨단 시대에 살고 있으며, 이러한 디지털 전환의 시기에 그 흐름에 선제적으로 대처할 수 있느냐 없느냐 여부가 조직의 명운을... ",https://www.nocutnews.co.kr/news/6095391,https://n.news.naver.com/mnews/article/079/0003863567?sid=102
790,2024-02-14 17:22:00,"비앤피랩, 망막질환 진단소프트웨어 임상시험계획 식약처 승인 완료","망막질환은 자각할 만한 뚜렷한 초기 증상이 없어 조기진단이 어려우나, <b>인공지능</b>(AI)을 활용한 ‘ICHI’는 안저 영상만으로 편리하게 망막질환의 위험을 진단․보조할 수 있다. 이번 승인된 임상시험계획은 안저영상... ",https://zdnet.co.kr/view/?no=20240214172134,https://n.news.naver.com/mnews/article/092/0002321302?sid=105
791,2024-02-14 17:22:00,AI 탑재 노트북·태블릿에 데이터센터까지…'저전력' 핵심 LPCAMM 전쟁,"<b>인공지능</b>(AI)이 일상에 본격적으로 스며들자 메모리 업황도 기지개를 펴면서, 차세대 D램 제품 개발 경쟁도 치열해지고 있습니다. 생성형 AI가 스마트폰·노트북·태블릿 등에 탑재되는 '온디바이스 AI'가... ",https://biz.sbs.co.kr/article_hub/20000156972?division=NAVER,https://n.news.naver.com/mnews/article/374/0000370463?sid=101
792,2024-02-14 17:21:00,"이지케어텍, 5개 분기 만에 영업 흑자",의료 <b>인공지능</b>(AI)을 활용한 서비스 개발도 진행 중이다. 최근 AI를 기반으로 폐질환 위험을 평가하는 소프트웨어 '이지어시스턴트 뉴모니아'의 임상을 성공적으로 마쳤다. 이지케어텍은 식품의약품안전처의 제조 인증... ,https://kormedi.com/?p=1663120,https://n.news.naver.com/mnews/article/296/0000074536?sid=101
793,2024-02-14 17:21:00,갤럭시S24·비전프로 속 나만의 AI… 비밀은 '멀티모달',"<b>인공지능</b>(AI) 산업이 시시각각 변하고 있습니다. GPT가 나오고 생성형 AI가 무엇인지 궁금해하던 때가 불과 한 해 전입니다. 지금은 텍스트, 이미지, 영상을 한꺼번에 이해하고 생성하는 AI가 나왔고, 보다 정확한 생성을... ",https://biz.chosun.com/industry/industry_general/2024/02/14/OTEQEVNVBVG5BHS4E637MWS73E/?utm_source=naver&utm_medium=original&utm_campaign=biz,https://n.news.naver.com/mnews/article/366/0000970372?sid=004
794,2024-02-14 17:20:00,"[전남일보]광주교육청, '초등 기초학력전담교사' 88명으로 확대","이외에 AI(<b>인공지능</b>)를 활용한 기초학력 진단 프로그램 시범 적용, 학습지원대상 학생 맞춤형 지원, 초3·중1 학생 대상 책임교육학력 지원 사업 등도 시행한다. 이정선 교육감은 “기초학력 향상 및 교육결손 해소를 위해... ",http://www.jnilbo.com/72766450825,http://www.jnilbo.com/72766450825
795,2024-02-14 17:18:00,"경운대, 제24회 전기 학위수여식 열어…총 957명 학위받아","장 부총재는 <b>인공지능</b>(AI)기술 발전 혁신과 바이두사의 세계적인 성공과 함께 국제IT산업 리더 역할을 맡으며 한중 산학협력과 구미 등 지역산업 기술경쟁력 확보에 기여했다. 진 회장은 중국 의료뷰티, 헬스케어 산업의... ",https://www.imaeil.com/page/view/2024021417150116071,https://n.news.naver.com/mnews/article/088/0000862263?sid=102
796,2024-02-14 17:18:00,"세종사이버대 컴퓨터·AI공학과, ‘생성형AI와 CES2024, 사라지는AI 스며드는...","더불어, 대학원 진학 등 경력 전환 프로그램 강화를 위해 산업계 경험이 풍부한 교수진을 중심으로 컴퓨터, 빅데이터·데이터과학, <b>인공지능</b>(AI), 클라우드, AIoT(<b>지능</b>형사물)의 5가지 전문가 과정을 통한 역량 인증... ",https://www.ekn.kr/web/view.php?key=20240214025187905,https://www.ekn.kr/web/view.php?key=20240214025187905
